first_name,last_name,email,password,education,latitude,longitude,skills,description
c254 first name,c254 last name,c254@email.com,password,none,-34.11540016835234,151.22695989528648,"['Supervisors', 'All Mining, Resources & Energy ', 'Litigation & Dispute Resolution', 'Environment & Sustainability Consulting', 'Management & Change Consulting', 'Rail & Maritime Transport', 'Community Services & Development', 'Market Research & Analysis', 'Assembly & Process Work', 'Surveying']",To secure a challenging career and lead a responsible role in your esteemed company and serve the organization with commitment and sincerity
c255 first name,c255 last name,c255@email.com,password,secondary,-34.03805133243626,151.25531973403943,"['Other', 'Other', 'Merchandisers', 'Other']",To work in a dynamic role in the field of ETL and Business Intelligence that encourages continuous learning and growth and helps me enhance my analytical abilities and professional growth
c256 first name,c256 last name,c256@email.com,password,PhD,-33.75603958690869,151.45705042229125,"['Hair & Beauty Services ', 'Housing & Homelessness Services']","To work on a challenging job profile which provides an opportunity to enhance my technical skills and knowledge, this could provide me an insight into new aspects so that it would be helpful for my career"
c257 first name,c257 last name,c257@email.com,password,secondary,-33.86308523804057,151.37666237232878,"['Air Conditioning & Refrigeration', 'Oil & Gas - Production & Refinement', 'Chefs/Cooks ', 'Contracts Management', 'All Accounting ', 'New Business Development', 'All Consulting & Strategy', 'Urban Design & Planning', 'Underwriting']","To work in an organization where I can enhance my knowledge, enhance my skills properly and find a good working environment where I would love to work"
c258 first name,c258 last name,c258@email.com,password,masters,-33.934759058078626,151.29014157185753,"['All Sales ', 'Consulting & Strategy', 'Chefs/Cooks ']",To work for an organization which provides me the opportunity to improve my skills and knowledge to growth along with the organization objective
c259 first name,c259 last name,c259@email.com,password,PhD,-33.70128402271575,151.3475431802178,"['Pattern Makers & Garment Technicians', 'Underwriting', 'Management ', 'All Self Employment', 'Team Leaders', 'Teaching - Early Childhood']",To contribute to the organizations growth by being a team member and to devote my management and technical skills for attaining the organizational goals and maximizing personal learning
c260 first name,c260 last name,c260@email.com,password,PhD,-33.79559700591794,151.401325582509,['Aviation Services'],"To achieve a challenging scenario where my abilities are put to test and my work has recognition and where my analytical, problem solving skills and application skills can be utilized to benefit the organization as well as to increase and enhance my knowledge"
c261 first name,c261 last name,c261@email.com,password,masters,-33.74013543486194,151.38565089324663,"['Art Direction', 'Carpentry & Cabinet Making ', 'Farm Labour', 'Laboratory & Technical Services']","To make my career as a Software Engineer in a reputed industry, being a Software Engineer, would like to enhance my knowledge and grow along with the organization"
c262 first name,c262 last name,c262@email.com,password,secondary,-33.72881038324398,151.47178108726928,"['Painters & Sign Writers', 'Accounts Receivable/Credit Control', 'Medical Administration', 'Management - Store ', 'Management & Change Consulting', 'Other', 'Architects', 'Public Transport & Taxi Services', 'Nursing - Community, Maternal & Child Health', 'Other']","To pursue a challenging education in Data Science and to thoroughly understand concepts of Computer Science, take up research in that area and contribute to the best of my abilities to the technological revolution"
c263 first name,c263 last name,c263@email.com,password,PhD,-33.98420832135043,151.25364321698578,"['Graphic Design', 'Fund Administration']",To secure a position where I can associate myself with an organization where there is an opportunity to share and contribute my knowledge for development of self and organization served
c264 first name,c264 last name,c264@email.com,password,masters,-33.939225239006426,151.4761320800182,"['Forensic Accounting & Investigation', 'Networks & Systems Administration', 'Retail Assistants ', 'Welders & Boilermakers ', 'Air Conditioning & Refrigeration', 'Litigation & Dispute Resolution', 'Corporate Development', 'Financial Planning', 'Purchasing, Procurement & Inventory', 'Front Office & Guest Services']","To achieve leading position in IT industry, wherein I can apply my skills and educational knowledge for the successful achievement of goals and growth of the organization"
c265 first name,c265 last name,c265@email.com,password,tertiary,-34.02672865132535,151.46780810843893,"['Board Appointments', 'All Farming, Animals & Conservation ', 'Occupational Health & Safety', 'Telecommunications', 'Laboratory & Technical Services', 'Agency Account Management', 'Automotive Trades ', 'All Manufacturing, Transport & Logistics ']","To secure a challenging job position in an organization involving good decision making, aspire to excel in whatever work I do and make my contribution a lasting one"
c266 first name,c266 last name,c266@email.com,password,PhD,-33.79063937305113,151.1347716818745,"['Bookkeeping & Small Practice Accounting', 'All Insurance & Superannuation', 'Residential Leasing & Property Management', 'Sales', 'Promotions', 'Industrial Engineering', 'Supervisors', 'Strategy & Planning', 'Materials Sciences', 'All Construction ']",To acquire a challenging career and be a part of progressive organization that gives me the scope to enhance my knowledge and showcase my skills towards the growth of the organization
c267 first name,c267 last name,c267@email.com,password,postgraduate,-33.91925166258298,150.91682282241183,"['Client Services', 'All Banking & Financial Services ', 'Oil & Gas - Engineering & Maintenance', 'Banking - Business', 'Couriers, Drivers & Postal Services', 'Other']",To learn and work in an established company
c268 first name,c268 last name,c268@email.com,password,secondary,-33.722669540774724,151.21271053986916,"['All Community Services & Development ', 'Agency Account Management', 'Employment Services', 'Mining - Operations', 'Government - Federal ']",To work in challenging environment where I can utilise my knowledge and apply in real world to generate something new
c269 first name,c269 last name,c269@email.com,password,none,-34.07945605487643,151.1566015750045,"['All Manufacturing, Transport & Logistics ', 'Payroll']","To obtain a challenging position in a progressive company, utilizing abilities developed through experience and education, with the opportunities for professional growth based on performance"
c270 first name,c270 last name,c270@email.com,password,none,-34.09269161685833,151.28946551070067,"['Management Accounting & Budgeting', 'Strategy & Planning', 'Criminal & Civil Law']",To work in challenging atmosphere by exhibiting my skills with sincerity and dedicated smart work for the growth of your esteemed organization along with mine
c271 first name,c271 last name,c271@email.com,password,postgraduate,-33.98621448082562,150.97000981140346,"['Accounts Payable', 'Veterinary Services & Animal Welfare', 'Event Management', 'Nursing - Paediatric & PICU', 'All Government & Defence ']",To be a Successful Web Developer in respected company and to achieve and the objectives of the company with honesty and fairness and to continuously upgrade my knowledge and skills
c272 first name,c272 last name,c272@email.com,password,secondary,-34.01414008098794,151.41318976791064,"['Engineering Drafting', 'Litigation & Dispute Resolution', 'Forensic Accounting & Investigation', 'Clinical/Medical Research']",To learn and function effectively in an organization and be able to deliver to the bottom line
c273 first name,c273 last name,c273@email.com,password,masters,-34.044610592736504,150.97438154441997,"['Event Management', 'Other', 'Financial Managers & Controllers', 'Superannuation', 'Photography', 'Medical Specialists', 'Team Leaders']",To contribute my skills in a challenging environment of a professionally managed reputed Organization which offers significant responsibilities and opportunities for growth and move into higher technology areas which provide an environment to improve my technical and analytical abilities
c274 first name,c274 last name,c274@email.com,password,PhD,-33.97578766627754,151.3180589878872,"['Other', 'Mining - Operations', 'Networks & Systems Administration', 'Materials Handling Engineering', 'Urban Design & Planning', 'Promotions', 'Systems Accounting & IT Audit']","To embark a career in creative and challenging environments, which will enable me to deploy my professional, educational and functional talents in the best possible way to reach the goals of the organization, myself and the society as a whole"
c275 first name,c275 last name,c275@email.com,password,postgraduate,-33.79789110546114,151.192937293391,"['Government - Local ', 'Sales Coordinators', 'Building Services Engineering']",To work for a huge Multinational Global Enterprise to achieve the organisational goals with adoption of methodical approach towards the work assigned
c276 first name,c276 last name,c276@email.com,password,tertiary,-33.88812532781512,151.23426016765887,"['Remuneration & Benefits', 'Banking - Retail/Branch', 'Company Secretaries', 'Army', 'Electricians ']","To progress in organization through dedication, Smart, hard work and delivering the best of my capabilities and to prove myself in the organization"
c277 first name,c277 last name,c277@email.com,password,secondary,-33.71210186110793,151.0327670449005,"['Air Conditioning & Refrigeration', 'Fitters, Turners & Machinists', 'Systems Engineering', 'Health, Safety & Environment', 'Other', 'Management', 'Electrical/Electronic Engineering', 'Other', 'Winery & Viticulture', 'Biological & Biomedical Sciences']",To succeed in an environment of growth and excellence and earn a job which provides me job satisfaction
c278 first name,c278 last name,c278@email.com,password,masters,-33.985330161331824,151.40645937723122,"['Research & Fellowships', 'Property Law', 'Accounts Receivable/Credit Control', 'Laboratory & Technical Services', 'Army', 'Analysis & Reporting', 'Mining - Exploration & Geoscience']",To work in pragmatic way in an organization where I can show my talent and enhance my skills to meet company goals and objective with full integrity and zest
c279 first name,c279 last name,c279@email.com,password,postgraduate,-33.636205645043255,151.03303630696325,"['Analysts', 'Assembly & Process Work', 'Treasury', 'Management - Area/Multi-site', 'Health, Safety & Environment', 'All Manufacturing, Transport & Logistics ', 'Photography', 'All Healthcare & Medical ', 'Engineering Drafting']","To obtain a position where my communication, leadership, managerial, computing, software and technical skill are utilized to its best"
c280 first name,c280 last name,c280@email.com,password,masters,-34.08775782707591,151.20764896342118,"['Management', 'Other']",To secure a challenging position in an organization that utilizes my engineering and analytical skills in overall growth of that organization
c281 first name,c281 last name,c281@email.com,password,tertiary,-33.92654330835713,151.34596029290861,"['Consultants', 'Other', 'Student Services', 'Environment & Sustainability Consulting', 'Team Leaders/Supervisors']",To work for an organization which provides me the opportunity to improve my skills and knowledge to growth along with the organization objective
c282 first name,c282 last name,c282@email.com,password,postgraduate,-33.72190267247083,151.06323997308945,"['Brand Management', 'Strategy & Planning']",To achieve a challenging position to work in an environment where performance is rewarded by utilizing my caliber
c283 first name,c283 last name,c283@email.com,password,PhD,-33.90255071604604,151.43301497980525,"['Other', 'Intellectual Property Law', 'Workplace Training & Assessment', 'Chiropractic & Osteopathic', 'Kitchen & Sandwich Hands', 'Recruitment - Internal', 'Insurance & Superannuation Law', 'Nursing - Community, Maternal & Child Health', 'Web Development & Production']","To seek the challenging position in software industry that needs innovation, creativity, dedication and enable me to continue to work in a challenging environment, leveraging my current knowledge"
c284 first name,c284 last name,c284@email.com,password,none,-34.01125303068758,151.25473263044367,"['Nursing - Community, Maternal & Child Health', 'Business/Systems Analysts', 'All Government & Defence ', 'Other', 'Legal Secretaries']",To work in a challenging and creative atmosphere where I can upgrade my skills and use my creative ability
c285 first name,c285 last name,c285@email.com,password,tertiary,-33.99341212341417,151.3417651537867,"['Strategy & Planning', 'Environmental Services', 'Other', 'All Science & Technology', 'Emergency Services', 'Agency Account Management', 'Banking - Corporate & Institutional', 'Other', 'Programming & Production']",To work and contribute to my fullest potential in a progressive organization where I can continue to learn and acquire skills that would benefit me and the organization
c286 first name,c286 last name,c286@email.com,password,masters,-33.93540592960161,151.3309556485704,"['Chemistry & Physics', 'Planning & Scheduling', 'Management ', 'Other', 'Banking & Finance Law', 'Recruitment - Internal', 'Navy', 'Machine Operators', 'Other', 'Butchers']","To work in a challenging environment, utilizing my skill, knowledge and expertise to the best of my abilities and contribute positively to my personal growth as well as growth of the organization"
c287 first name,c287 last name,c287@email.com,password,masters,-33.66627251603475,151.0143692272667,['Reservations'],"To be associated with progressive organization that gives me scope to update my skills as well as to work in a healthy, innovative and challenging environment extracting the best out of me, which is to learn and grow at both professional and personal level thereby directing my future as an assets to the organization and to be a part of the team that dynamically works towards the growth of the organization"
c288 first name,c288 last name,c288@email.com,password,masters,-34.03432150792827,150.96746238160208,"['Legal Practice Management', 'All Community Services & Development ']","To earn an identity of a valuable asset to my organization and build a value driven, exemplary career in Global Information and Technology industry"
c289 first name,c289 last name,c289@email.com,password,postgraduate,-34.02186786112756,151.3388690460504,"['Medical Specialists', 'Front Office & Guest Services', 'Administration', 'Analysis & Reporting', 'Natural Resources & Water', 'Treasury', 'Financial Planning', 'Plant & Machinery Operators ']",To take up a job that would offer me a platform for putting my strength to the best use and enhancing my skills set eventually and helping me to advance to a more suitable position in the Industry
c290 first name,c290 last name,c290@email.com,password,masters,-33.88135154443058,150.88336060206885,"['Floristry', 'Other']",To associate with the market leader as an Application Support personnel wherein I have the privilege to work efficiently and be a part of the success story in the long run
c291 first name,c291 last name,c291@email.com,password,none,-34.06036994828901,151.279982017826,"['Oil & Gas - Production & Refinement', 'Engineering Drafting', 'All Call Centre & Customer Service ']",To work for an organization which provides me the opportunity to use my past experience and improve my skill and knowledge for growth along with the organization objective
c292 first name,c292 last name,c292@email.com,password,secondary,-34.123053145805805,151.17421272350575,"['Other', 'Farm Labour', 'Buying', 'Speech Therapy', 'Other']","To work in learning and challenging environment, utilizing my skills and knowledge to the best of my abilities and contribute positively to my personal growth as well as growth of the organization"
c293 first name,c293 last name,c293@email.com,password,PhD,-33.72880186638965,151.50053635970573,['Fishing & Aquaculture'],To work in pragmatic way in an organization where I can show my talent and enhance my skills to meet Company goals and objectives with full integrity and zest
c294 first name,c294 last name,c294@email.com,password,none,-33.85938926420024,151.4282600383457,"['Records Management & Document Control', 'Import/Export & Customs', 'Other', 'All Construction ', 'Process Engineering']",To be professionally associated with an extern organization with an objective to accept challenges and work hard towards achieving goals of organization and self
c295 first name,c295 last name,c295@email.com,password,none,-33.963302162702824,151.002864016908,"['Natural Therapies & Alternative Medicine', 'Strategy & Planning', 'Consulting & Generalist HR', 'Nannies & Babysitters', 'Materials Sciences', 'Mining - Operations', 'All Self Employment', 'Digital & Search Marketing', 'Architectural Drafting', 'Oil & Gas - Drilling']","To learn new things, implement my knowledge in practical life, and to provide my best to achieve goals of myself and my company"
c296 first name,c296 last name,c296@email.com,password,secondary,-33.68501017058347,151.32138661175006,"['All Human Resources & Recruitment ', 'Civil/Structural Engineering', 'Other', 'Banking - Corporate & Institutional', 'Actuarial', 'Police & Corrections']",To work in a highly competitive environment with a perfect challenge by contributing the best for the growth of the organization while ensuring growth in personal career
c297 first name,c297 last name,c297@email.com,password,masters,-33.684517101104554,151.20573444621465,"['Stockbroking & Trading', 'Quality Assurance & Control', 'Fundraising', 'Air Force', 'Policy, Planning & Regulation', 'Plumbers']","To secure a challenging position where I can effectively contribute my skills, possessing competent technical skills"
c298 first name,c298 last name,c298@email.com,password,PhD,-34.04764016670846,151.03845320024175,"['Management Accounting & Budgeting', 'Banking - Corporate & Institutional', 'All Manufacturing, Transport & Logistics ']","To become a successful professional in the field of Android development in IT sector, and to work in an innovative and competitive company"
c299 first name,c299 last name,c299@email.com,password,none,-33.93111445746751,151.25266532513592,"['Stockbroking & Trading', 'Management - Vocational', 'Security', 'Management - Internal', 'Hair & Beauty Services ', 'Optical']",To obtain a position where my knowledge can be utilized and expanded
c300 first name,c300 last name,c300@email.com,password,postgraduate,-33.659516405287704,151.17203267818036,"['Forensic Accounting & Investigation', 'Public Relations & Corporate Affairs', 'Other', 'Brokerage', 'Corporate & Commercial Law', 'Industrial Relations & Employment Law']","To serve the pharmaceutical industry with the skills that I have learned during my educational tenure and ultimately serve nation and mankind in the field of Healthcare, pharmaceuticals and research"
c301 first name,c301 last name,c301@email.com,password,none,-33.73665050270817,151.0902582403019,"['Generalists - Law Firm', 'Fundraising', 'Sales - Inbound', 'Butchers', 'Fitness & Personal Training', 'Gardening & Landscaping', 'Food Technology & Safety', 'Pharmaceuticals & Medical Devices']",To seek a challenging positions in a company with an open energetic and vibrant both environment which provides for continuous learning and career growth
c302 first name,c302 last name,c302@email.com,password,masters,-33.92648086272972,151.3751110527831,"['Army', 'Buying', 'Teaching - Tertiary', 'Family Law']",To be professionally associated with an extern organization with an objective to accept challenges and work hard towards achieving goals of organization and self
c303 first name,c303 last name,c303@email.com,password,PhD,-34.09862859859852,151.29538150606857,"['Other', 'Front Office & Guest Services']",To secure a challenging position in my field of study where I can sharpen my skills to contribute for the growth of my company and for achieving a brighter career
c304 first name,c304 last name,c304@email.com,password,secondary,-33.919778518084605,151.49002846908783,"['Other', 'Remuneration & Benefits', 'Customer Service - Call Centre', 'Other', 'Management', 'Systems Accounting & IT Audit', 'Bakers & Pastry Chefs', 'Nannies & Babysitters', 'Merchandisers', 'Project Management']","To be a part of a renowned organization and utilize my experience, communication and interpersonal skills so as to work as a good team member in the growth and development of the organization"
c305 first name,c305 last name,c305@email.com,password,secondary,-34.041033039981144,151.4245115241563,"['Networks & Systems Administration', 'Workplace Training & Assessment', 'Retail Assistants ']","To achieve professional growth while being resourceful, innovative and flexible and work in an innovative and competitive world where I can effectively contribute my skills to deliver my potential and make best use of my efforts to contribute towards the growth of an organization"
c306 first name,c306 last name,c306@email.com,password,none,-33.819513103274915,151.4773045581579,"['Chefs/Cooks ', 'Mechanical Engineering', 'Cleaning Services', 'Winery & Viticulture', 'Industrial Engineering', 'Management', 'Insurance & Superannuation Law', 'Superannuation', 'Mining - Engineering & Maintenance ']",To join a stable organization where my skills are valued and which can help me grow in my career
c307 first name,c307 last name,c307@email.com,password,tertiary,-34.02885958368399,151.15467053077106,"['Account & Relationship Management', 'Banking & Finance Law', 'Plumbers', 'Receptionists', 'Aged & Disability Support ', 'Company Secretaries', 'Other', 'Chefs/Cooks ']","To work as an efficient employee, giving optimum output in achieving the goal of the Organization towards success, by contributing knowledge and professional work attitude"
c308 first name,c308 last name,c308@email.com,password,PhD,-33.913218471196174,151.19865475286542,"['Other', 'Management & Change Consulting', 'Oil & Gas - Drilling', 'Pattern Makers & Garment Technicians', 'Farm Labour', 'Management', 'Printing & Publishing Services']",To become a successful professional engineer and to work in an organization where my educational and creative skills can be applied for its benefits and my knowledge can be enriched and advanced technologies
c309 first name,c309 last name,c309@email.com,password,PhD,-33.87010017970171,151.34028874071316,"['Bakers & Pastry Chefs', 'Freight/Cargo Forwarding', 'Testing & Quality Assurance']",To obtain a position in your esteemed organization so that I can work under highly experienced professionals and upgrade my knowledge and skills about the industry and work for benefit of the organization
c310 first name,c310 last name,c310@email.com,password,tertiary,-33.907039955387525,151.32769559983265,"['Teaching - Primary', 'Policy', 'Pharmaceuticals & Medical Devices', 'Research & Fellowships', 'Environmental Engineering']",To work in the most challenging position with an organization that provides ample opportunities to learn and to contribute
c311 first name,c311 last name,c311@email.com,password,tertiary,-33.914145314902,150.87973567191582,"['All Sport & Recreation', 'Aged & Disability Support ']","To Start and Build a career in field of Electronics and Telecommunication Engineering with my Confidence, Motivation and Hardworking Skills"
c312 first name,c312 last name,c312@email.com,password,tertiary,-34.02734494927192,151.2647404320096,"['Board Appointments', 'Brand Management']",To secure a challenging and rewarding position as Android Developer with an established organization that can utilize my skills and experience
c313 first name,c313 last name,c313@email.com,password,tertiary,-33.69848857038833,151.45252480660426,"['Customer Service - Customer Facing', 'Chiropractic & Osteopathic', 'Residents & Registrars', 'Workplace Training & Assessment', 'Management', 'Water & Waste Engineering']",To work in an innovative and challenging environment wherein I can use my potential and knowledge for benefit of organization and myself
c314 first name,c314 last name,c314@email.com,password,postgraduate,-34.00067620875139,151.2849988845513,"['Kitchen & Sandwich Hands', 'Event Management', 'Retail & Property Development', 'Accounts Officers/Clerks', 'Corporate & Commercial Law', 'Consultants', 'Analysis & Reporting']","To work in an organization where I can utilization my knowledge, skills and ability to enhance my complete potential in order to grow and meet the challenges of competitive environment and work professionally"
c315 first name,c315 last name,c315@email.com,password,masters,-33.69017585889666,151.1788549709831,"['Plumbers', 'Warehousing, Storage & Distribution ', 'Property Law', 'Materials Sciences', 'Residential Sales']",To work in a creative and competitive environment rendering my potentials and skills to the maximum and keep learning through working for the growth of the company and growing along with it
c316 first name,c316 last name,c316@email.com,password,masters,-33.98812622619559,150.90799263257244,"['Teaching Aides & Special Needs', 'Civil/Structural Engineering', 'Gaming', 'Programming & Production', 'Environmental, Earth & Geosciences', 'Horticulture', 'Project Management', 'Optical']",To gain employment with a company that offers me a consistently positive atmosphere to learn new technologies and implement them for the betterment of the business
