first_name,last_name,email,password,education,latitude,longitude,skills,description
c713 first name,c713 last name,c713@email.com,password,postgraduate,-33.99693159659845,151.39176343324607,"['Electricians ', 'Contracts Administration', 'Road Transport ', 'Management', 'Industrial Relations & Employment Law', 'Front Office & Guest Services', 'Engineering - Network']",To secure a challenging career which demands the best of my professional ability in terms of technical and analytical skills and help me in broadening and enhancing my current skill and knowledge
c714 first name,c714 last name,c714@email.com,password,masters,-33.74313565383704,151.14106033661238,"['Collections', 'Modelling & Simulation', 'Consulting & Strategy', 'Payroll', 'Other', 'Chemical Engineering']","To achieve a position which utilizes my knowledge and provides me a platform to innovate, learn new technologies and execute different responsibilities, while significantly contributing to the business needs of the organization"
c715 first name,c715 last name,c715@email.com,password,PhD,-33.63146324642942,151.03866667603262,"['Insolvency & Corporate Recovery', 'Telecommunications', 'Materials Handling Engineering', 'Market Research & Analysis', 'Engineering - Software', 'Residents & Registrars', 'Other', 'All Information & Communication Technology ', 'Sales - Inbound', 'Tutoring']",To secure a challenging position where I can effectively exhibit my talents and skills for growth of the organization which in turn would aid my professional outcome
c716 first name,c716 last name,c716@email.com,password,none,-34.07227893801828,151.3401258945039,"['Account & Relationship Management', 'Process Engineering', 'Recruitment - Internal']",To work in a challenging atmosphere by exhibiting my skills with at most sincerity and dedicated smart work for the growth of your esteemed organization along with mine
c717 first name,c717 last name,c717@email.com,password,postgraduate,-33.99242049069762,151.4148935837905,"['Physiotherapy, OT & Rehabilitation ', 'Quality Assurance & Control', 'Analysts', 'Police & Corrections', 'Agency Account Management', 'All Mining, Resources & Energy ', 'All Hospitality & Tourism ', 'Industrial Design', 'Electrical/Electronic Engineering', 'Employment Services']","To prove myself dedicated, worthy and energetic in a progressive organization that gives me chance to apply my knowledge and skills, and be a member of a team that dynamically work towards the growth of the organization"
c718 first name,c718 last name,c718@email.com,password,PhD,-33.71815597794222,151.07446442859884,"['Technical Writing', 'Pattern Makers & Garment Technicians', 'Aviation Services', 'All Education & Training ']","To become a contributing SAP Technical Consultant, in an organization for its success, by applying the best business practices, through innovation solutions and constantly updating my skill"
c719 first name,c719 last name,c719@email.com,password,tertiary,-33.671165668121795,151.4266618807788,"['All Education & Training ', 'Sales Representatives/Consultants ', 'Stockbroking & Trading', 'Butchers']",To seek a career in a reputed organization that will help me to grow with the organization and to acquire new knowledge and skills apply my knowledge in that field
c720 first name,c720 last name,c720@email.com,password,none,-34.04698568331096,151.12929910244952,"['Computer Operators', 'Compliance & Risk', 'Army', 'All Sales ', 'Other', 'Forensic Accounting & Investigation', 'Records Management & Document Control', 'Financial Planning', 'Natural Therapies & Alternative Medicine', 'Systems Engineering']","To pursue a challenging education in Data Science and to thoroughly understand concepts of Computer Science, take up research in that area and contribute to the best of my abilities to the technological revolution"
c721 first name,c721 last name,c721@email.com,password,postgraduate,-34.04263441089866,151.09213577917714,"['Public Relations & Corporate Affairs', 'Cleaning Services', 'Pattern Makers & Garment Technicians']","To work in a creative and challenging environment, utilizing my skills and knowledge to be the best of my abilities and contribute positively to my personal growth as well as growth of the organization"
c722 first name,c722 last name,c722@email.com,password,masters,-33.81609273616694,151.24139122859822,['Assembly & Process Work'],To be a part of an organization where I get a chance to use my knowledge and skill to contribute in the progress of the organization as well as myself
c723 first name,c723 last name,c723@email.com,password,secondary,-33.99283939185837,151.2853186042557,"['Process Engineering', 'All Human Resources & Recruitment ', 'All Engineering ', 'Legal Secretaries', 'Nursing - Psych, Forensic & Correctional Health', 'Superannuation', 'COO & MD', 'All Hospitality & Tourism ', 'Plant & Machinery Operators ']",To secure position as a Software Engineer where I can effectively contribute my skills for growth of the organization and for myself
c724 first name,c724 last name,c724@email.com,password,postgraduate,-33.726117247054106,151.13707369022572,"['Management - Agency', 'Oil & Gas - Production & Refinement', 'Personal Injury Law', 'Other', 'Intellectual Property Law', 'Freight/Cargo Forwarding', 'All Information & Communication Technology ', 'Fishing & Aquaculture', 'Ambulance/Paramedics', 'Analysts']",To be an ideal employee and to work efficiently in an innovative and competitive world with leading corporates while learning new roles
c725 first name,c725 last name,c725@email.com,password,tertiary,-33.857616231228086,151.50827410867433,"['Database Development & Administration', 'Waiting Staff', 'Housekeeping', 'Treasury', 'All Manufacturing, Transport & Logistics ', 'Aerospace Engineering', 'Generalists - In-house']",To work on a job profile which provides an opportunity to improve my skill and knowledge
c726 first name,c726 last name,c726@email.com,password,tertiary,-33.86144461055013,151.04808774319167,['Forensic Accounting & Investigation'],"To pursue a challenging education in Data Science and to thoroughly understand concepts of Computer Science, take up research in that area and contribute to the best of my abilities to the technological revolution"
c727 first name,c727 last name,c727@email.com,password,secondary,-33.849313972217686,151.38176927976468,"['Developers/Programmers ', 'Surveying', 'Risk Consulting', 'Mining - Processing', 'Receptionists', 'Account & Relationship Management']",To work in an environment that continues to nurture innovation
c728 first name,c728 last name,c728@email.com,password,masters,-33.714942347619086,151.08944212663513,['Plant & Machinery Operators '],"To work in a highly competitive environment where a culture of freedom and working for initiatives is ensured, with a perfect challenge by contributing the best for the growth of the organization while ensuring growth in personal career"
c729 first name,c729 last name,c729@email.com,password,masters,-33.927169431928796,150.89674362336723,"['Engineering - Network', 'Management ', 'Environmental, Earth & Geosciences', 'Photography', 'Pattern Makers & Garment Technicians', 'All Legal ', 'Chemical Engineering', 'Agronomy & Farm Services', 'Analysts']",To pursue a challenging career and be a part of progressive organization that gives scope to enhancemy knowledge and utilize my skills towards the growth of the organization
c730 first name,c730 last name,c730@email.com,password,postgraduate,-33.74225363969931,151.3945970110509,"['Import/Export & Customs', 'Oil & Gas - Drilling', 'Bar & Beverage Staff']",To work in an environment which encourages me to succeed and grow professionally where I can utilize my skills and knowledge appropriately
c731 first name,c731 last name,c731@email.com,password,postgraduate,-33.79373639050138,151.2076361512745,"['Analysis & Reporting', 'Legal Practice Management', 'Management - Internal']","To be a part of the team this is open to sharing, learning, and hard work and criticism"
c732 first name,c732 last name,c732@email.com,password,tertiary,-33.66863005685696,151.38026481349078,"['Company Secretaries', 'Laboratory & Technical Services', 'Materials Handling Engineering', 'Freight/Cargo Forwarding']",To secure a challenging career which demands the best of my professional ability in terms of technical and analytical skills and help me in broadening and enhancing my current skill and knowledge
c733 first name,c733 last name,c733@email.com,password,masters,-33.90593599426262,150.8707877437658,"['Childcare & Outside School Hours Care ', 'Teaching - Tertiary', 'Other', 'Materials Sciences', 'Other', 'Library Services & Information Management', 'Office Management', 'Natural Therapies & Alternative Medicine', 'Project Management', 'Electricians ']",To pursue a highly challenging career in IT industries where I can apply my knowledge to acquire new skills and work closely with experienced professionals
c734 first name,c734 last name,c734@email.com,password,none,-33.67601417690594,151.2631466560619,"['All Accounting ', 'Navy', 'Aerospace Engineering', 'Customer Service - Customer Facing', 'Art Direction', 'Mining - Exploration & Geoscience', 'Nursing - High Acuity', 'Other', 'Travel Agents/Consultants', 'Tour Guides']",To work in pragmatic way in an organisation where i contribute and enhance my technical and management skill to meet organisation goals and objectives with full integrity and zest
c735 first name,c735 last name,c735@email.com,password,tertiary,-33.898273367133086,150.9167078593375,"['Airlines', 'Compliance & Risk', 'Business Services & Corporate Advisory', 'Student Services', 'Environmental Services', 'Farm Labour', 'Systems Engineering']",To join a fast growing organization where I can enhance my knowledge and utilize my analytical and professional skills for the benefits of the organization
c736 first name,c736 last name,c736@email.com,password,secondary,-34.07978505201064,151.09106932055454,"['Industrial Design', 'Maintenance', 'Housekeeping', 'Housing & Homelessness Services']",To gain an insight view in a challenging environment which provides me the opportunity to exercise my engineering and interpersonal skill which can help me to enhance my knowledge for the development of self and organization
c737 first name,c737 last name,c737@email.com,password,tertiary,-34.035596850642726,150.9960485688045,"['Dental ', 'Conservation, Parks & Wildlife', 'Kitchen & Sandwich Hands']","To work hard with full dedication for the achievement of organization objective under satisfying job contact, hence enhancing my skill and knowledge and ready to learn new things"
c738 first name,c738 last name,c738@email.com,password,masters,-33.884912944248285,150.89272356936561,"['Client Services', 'All Hospitality & Tourism ', 'Cost Accounting', 'Other', 'Corporate Development', 'Printing & Publishing Services', 'Accounts Officers/Clerks', 'Quality Assurance & Control', 'Management', 'Reservations']",To obtain a professionally rewarding career with an institution that provides good opportunity for putting my knowledge and experience into practice along with the enhancement of professional skills and personal qualities
c739 first name,c739 last name,c739@email.com,password,tertiary,-33.690997664289185,151.128870097499,"['Bakers & Pastry Chefs', 'Laboratory & Technical Services']","To continuously enhance my knowledge, skills and experience by getting involved in challenging work environment and utilize them for personal and organizational growth to best of my ability"
c740 first name,c740 last name,c740@email.com,password,none,-33.949381558435675,151.13585837416514,"['Supervisors/Team Leaders', 'All Self Employment', 'Management', 'Purchasing, Procurement & Inventory', 'Records Management & Document Control', 'Accounts Officers/Clerks', 'Engineering - Software']",To work in a challenging atmosphere by exhibiting my skills with utmost sincerity and dedicated smart work for a growth of your esteemed organization along with mine
c741 first name,c741 last name,c741@email.com,password,none,-33.9217572206215,151.36918517729185,"['Market Research & Analysis', 'All Consulting & Strategy', 'Field Engineering', 'Web & Interaction Design']",To Curve out a special place in the field of Computer that help me to attain greater of my Career
c742 first name,c742 last name,c742@email.com,password,PhD,-33.67749159199447,151.12318188358748,"['Remuneration & Benefits', 'Funds Management']","To be involved in an Organization where, I can utilize and learn more skills and creatively involved with system that effectively contributes to the growth of the Organization"
c743 first name,c743 last name,c743@email.com,password,PhD,-33.623531150582224,151.13550797365326,"['All Real Estate & Property ', 'Analysis & Reporting', 'Veterinary Services & Animal Welfare', 'All Science & Technology', 'Mining - Engineering & Maintenance ']","To work in a firm with a professional work driven environment where I can utilize and apply my knowledge, skills which would enable me as a fresher to grow while fulfilling organizational goals"
c744 first name,c744 last name,c744@email.com,password,PhD,-33.77499469363236,151.26670865318974,"['Landscape Architecture', 'Fishing & Aquaculture', 'Nursing - Psych, Forensic & Correctional Health', 'Materials Handling Engineering']",To join a stable organization where my skills are valued and which can help me grow in my career
c745 first name,c745 last name,c745@email.com,password,tertiary,-33.646092155715564,151.23928113582565,"['All Insurance & Superannuation', 'Teaching - Tertiary', 'Criminal & Civil Law', 'Field Engineering', 'Technicians ', 'Couriers, Drivers & Postal Services']","To associate with an organization that progresses dynamically and provides me with the opportunity to enhance my knowledge and skills, in the state of art technologies and be a part of the challenging team which strives for the better growth of the organization and my satisfaction thereof"
c746 first name,c746 last name,c746@email.com,password,PhD,-33.771847046998076,151.5136620421849,"['Mining - Drill & Blast', 'Food Technology & Safety', 'Collections', 'Library Services & Information Management', 'Insurance & Superannuation Law', 'Legal Practice Management', 'Carpentry & Cabinet Making ']",To enhance my educational and professional skills in a stable and dynamic workplace
c747 first name,c747 last name,c747@email.com,password,secondary,-33.99656377773268,150.9665363716771,"['Nursing - High Acuity', 'Treasury', 'Mining - Operations', 'Tutoring']","To secure a challenging position in a reputable organization to expand my learning, knowledge, and skills"
c748 first name,c748 last name,c748@email.com,password,secondary,-33.75924197868649,151.1881560166581,['Organisational Development'],To accept challenging assignments in a competitive environment that would yield the benefits of job satisfaction and mutual growth
c749 first name,c749 last name,c749@email.com,password,PhD,-33.860002368059206,151.0488372946532,['Management & Change Consulting'],To work for an organization which provides me the opportunity to my skills and knowledge to growth along with the organization objective
c750 first name,c750 last name,c750@email.com,password,secondary,-34.08394664016442,151.07510149643926,"['Sales - Pre & Post', 'Library Services & Information Management', 'Estimating', 'Administrative Assistants ', 'Law Clerks & Paralegals', 'Nannies & Babysitters', 'Pickers & Packers', 'Cleaning Services']",To work with determination and dedication to achieve organization as well as personal goals
c751 first name,c751 last name,c751@email.com,password,postgraduate,-33.73416255744038,151.32542113344635,"['Industrial & Employee Relations', 'Landscape Architecture', 'Planning', 'Medical Administration', 'Team Leaders', 'Health, Safety & Environment', 'Industrial Relations & Employment Law', 'Product Management & Development', 'Property Law', 'Maintenance']",To withstand at very hardest possibility of life where no one can ever step and aspire to learn at every aspect of life with the maximum mind form to succeed in the life
c752 first name,c752 last name,c752@email.com,password,masters,-33.92196668923418,151.12059740050873,"['Couriers, Drivers & Postal Services']","To continuously enhance my knowledge, skills and experience by getting involved in challenging work environment and utilize them for personal and organizational growth to the best of my ability"
c753 first name,c753 last name,c753@email.com,password,postgraduate,-33.959446186124545,151.33535643561638,"['All Banking & Financial Services ', 'All Call Centre & Customer Service ', 'Business/Systems Analysts', 'Management & Change Consulting', 'Programme & Project Management', 'Pharmacy', 'Collections']",To grow in a challenging environment with the organization and parallely want to gain knowledge about new technology and master in my area of interest
c754 first name,c754 last name,c754@email.com,password,secondary,-33.82908819915248,151.35143357769041,"['Workplace Training & Assessment', 'Records Management & Document Control', 'Couriers, Drivers & Postal Services', 'Other']","To seek enjoyable challenging assignment and responsibility, with an opportunity for growth and career advancement as successful achievements"
c755 first name,c755 last name,c755@email.com,password,PhD,-33.71468481534852,151.0651844895108,"['Fashion & Textile Design', 'Speech Therapy', 'Intellectual Property Law', 'Other', 'Analysts', 'Management - Vocational', 'Government - Federal ', 'Civil/Structural Engineering', 'Gaming', 'Workplace Training & Assessment']",To work with a company this appreciates smart work and creativity so that I can utilize my knowledge and skills to give my best for the growth of the company as well as to gain practical experience
c756 first name,c756 last name,c756@email.com,password,PhD,-33.90875424981699,151.1467594260609,"['Graphic Design', 'All Marketing & Communications ', 'Management', 'Mining - Operations', 'Nursing - Management', 'Project Management', 'Health, Safety & Environment', 'Other', 'Public Relations & Corporate Affairs']",To be associated with a progressive organization which provides me the scope to apply my knowledge and skills towards the accomplishment of goals of organization
c757 first name,c757 last name,c757@email.com,password,tertiary,-33.894870834836276,151.25114998409538,"['Production, Planning & Scheduling', 'Maintenance', 'Other', 'Forensic Accounting & Investigation', 'Claims', 'Teaching - Tertiary']",To become a skilled IT professional and build a great career
c758 first name,c758 last name,c758@email.com,password,none,-33.72076390415909,151.49522085124838,"['Project Management', 'Financial Managers & Controllers', 'Management & Support', 'Banking - Business', 'Brand Management', 'Other', 'Performing Arts', 'Building Trades', 'Winery & Viticulture']",To get the working opportunity in esteem organization where my academic excellence will add value towards organization and personal growth
c759 first name,c759 last name,c759@email.com,password,none,-33.865264335195654,150.8825916529232,"['Other', 'Labourers ', 'Industrial & Employee Relations', 'Quality Assurance & Control', 'Carpentry & Cabinet Making ', 'All Consulting & Strategy', 'Management', 'Other', 'Technicians ', 'Travel Agents/Consultants']","To excel in my activity by taking up challenging assignments at the workplace, contribute to the growth of the organization by putting to use my skills, experience and knowledge acquired over time"
c760 first name,c760 last name,c760@email.com,password,none,-33.922607477173294,151.02770552295874,"['All Self Employment', 'All Marketing & Communications ', 'All Community Services & Development ']",To be associated with an organization which offers excellent and challenging grounds to reinforce my learning
c761 first name,c761 last name,c761@email.com,password,postgraduate,-33.66767363371391,151.3876490672754,"['Workplace Training & Assessment', 'Public Transport & Taxi Services', 'Security Services', 'Insolvency & Corporate Recovery', 'Management', 'PA, EA & Secretarial', 'Data Entry & Word Processing', 'Client Services']","To work in a globally competitive environment on challenging assignment where my knowledge, experience and enthusiasm will have application and will also give a head start to my professional growth"
c762 first name,c762 last name,c762@email.com,password,postgraduate,-33.76709774206432,151.43305308484565,"['Airlines', 'Accounts Officers/Clerks', 'Residential Sales', 'Funds Management', 'Automotive Engineering', 'Nursing - Midwifery, Neo-Natal, SCN & NICU', 'Management', 'Retail Assistants ', 'Project Management']",To indulge in every possible chances to part my commitment towards the organizational goals and bring myself to grow into a fully equipped working self
c763 first name,c763 last name,c763@email.com,password,secondary,-33.92411792648164,150.92031072575062,['Administrative Assistants '],"To pursue a successful and rewarding career by handling competitive and challenging assignments, so as to contribute the best of my ability towards the growth and development of a progressive company"
c764 first name,c764 last name,c764@email.com,password,PhD,-33.93726722800402,150.97292757945172,"['Team Leaders/Supervisors', 'Property Law', 'All Call Centre & Customer Service ', 'Planning', 'Estimating', 'Other', 'Collections', 'Criminal & Civil Law', 'Residential Leasing & Property Management', 'Management']","To establish myself in a progressive and creative industrial environment that influences me to envision and enforce innovative ideas, utilizing my academic and professional background, technical and interpersonal skills in order to contribute towards product development and to improve myself"
c765 first name,c765 last name,c765@email.com,password,secondary,-33.66042873865671,151.35645018715502,"['Other', 'Management & Change Consulting', 'Assistant Accountants', 'Claims', 'Promotions']","To seek a challenging position in an IT industry and contribute extensively while being resourceful, innovative and flexible in an environment where there is opportunity for personal and professional growth"
c766 first name,c766 last name,c766@email.com,password,postgraduate,-33.85320365914786,151.1137093037607,"['Quality Assurance & Control', 'Underwriting', 'Intellectual Property Law', 'Printing & Publishing Services']",To seek a challenging job in a reputed organization and to integrate my knowledge in your esteemed organization
c767 first name,c767 last name,c767@email.com,password,none,-33.886891985766056,151.396147824211,['Pattern Makers & Garment Technicians'],To Bring My Skills and Experience into an Organizational Manner and become a Valuable Member of the Technological World
c768 first name,c768 last name,c768@email.com,password,PhD,-33.762850793357956,151.51103433180444,"['Modelling & Simulation', 'Architects']",To be a part of dynamic environment and looking at professional growth by way of harmonizing the organizational goals with personal goals
c769 first name,c769 last name,c769@email.com,password,PhD,-33.652585482368806,151.41996865308263,"['Airlines', 'Medical Administration', 'Civil/Structural Engineering', 'Management - Agency', 'Pharmaceuticals & Medical Devices', 'Other', 'Marketing Communications', 'Promotions', 'Sales - Inbound']",To work in an environment which encourages me to succeed and grow professionally where I can utilize my skills and knowledge appropriately
c770 first name,c770 last name,c770@email.com,password,tertiary,-33.804828317239135,151.0036350699573,"['Oil & Gas - Exploration & Geoscience', 'Customer Service - Customer Facing', 'Recruitment - Agency', 'Superannuation', 'Production, Planning & Scheduling', 'Contracts Administration', 'Litigation & Dispute Resolution', 'Fishing & Aquaculture', 'Management & Support']",To gain and execute the expertise in IT sector in a dynamic environment and to use my experience and skills to generate the value in the organization simultaneously exploring my skills and progressing towards expertise
c771 first name,c771 last name,c771@email.com,password,secondary,-33.943208918383114,151.1224099994389,"['Other', 'Ambulance/Paramedics', 'Technicians ', 'Indigenous & Multicultural Services', 'Buying', 'Pharmacy']",To work in a professional environment where I can contribute myself and enrich my skills according to the latest technologies and to work towards achieving the organizational goals
c772 first name,c772 last name,c772@email.com,password,none,-34.12119262266615,151.12016092925847,"['Valuation', 'Cleaning Services', 'Accounts Officers/Clerks', 'Navy', 'Legal Practice Management', 'Assistant Accountants']",To excel as a professional in electronics industry and hold up a challenging position in core world through diligence and dedication to ensure my highest contribution towards the organization
c773 first name,c773 last name,c773@email.com,password,secondary,-34.063060895062144,151.35768810483978,"['Management', 'Compliance & Risk', 'Speech Therapy']","To obtain professional and financial heights, both for the organization and self, through skill and knowledge and learn from presents as well as establishment"
c774 first name,c774 last name,c774@email.com,password,postgraduate,-33.76728542851033,151.13545691002005,"['Field Engineering', 'Conservation, Parks & Wildlife', 'Cleaning Services', 'Fashion & Textile Design', 'Nursing - Psych, Forensic & Correctional Health', 'All Advertising, Arts & Media', 'Recruitment - Internal', 'Automotive Engineering', 'Programme & Project Management']",To work for an organization which provides me the opportunity to improve my skills and knowledge to growth along with the organization objective
