first_name,last_name,email,password,education,latitude,longitude,skills,description
c519 first name,c519 last name,c519@email.com,password,PhD,-33.94266243365816,151.52199231181686,"['Agency Account Management', 'Banking & Finance Law', 'Other', 'Butchers']","To be functional in reputed organization and explore my technical, database and management skills for the growth of organizations and this helps me towards achieving my career goals and enhance my technical knowledge about new and emerging trends in IT sector"
c520 first name,c520 last name,c520@email.com,password,tertiary,-33.74772222867301,151.34253910107375,"['Other', 'Records Management & Document Control', 'Other', 'Criminal & Civil Law']","To work in a stimulating environment where I can apply and enhance my knowledge, skills to serve the organization and strive for excellence"
c521 first name,c521 last name,c521@email.com,password,tertiary,-33.94709443367785,151.02107458411075,"['Accounts Officers/Clerks', 'Assessment']",To contribute my knowledge and talent for the development of the company and to improve my skills under guidance of the organization
c522 first name,c522 last name,c522@email.com,password,masters,-34.02657145985581,151.1158578376829,"['All Engineering ', 'Mining - Drill & Blast', 'Audit - External', 'Sales Representatives/Consultants ', 'Art Direction', 'All Hospitality & Tourism ']",To work in a challenging environment using all my skills of electronics and effort to explore in different field and seek an opportunity for continuous learning
c523 first name,c523 last name,c523@email.com,password,secondary,-33.71946302869669,151.27068556078532,"['Technicians ', 'Computer Operators', 'Tax Law', 'Other', 'Engineering - Software', 'All Design & Architecture', 'Board Appointments']",To work in a competitive environment on challenging assignments that shall yield the twin benefits of job Satisfaction and a steady paced professional growth
c524 first name,c524 last name,c524@email.com,password,tertiary,-33.750336751482656,151.30633913640332,"['Computer Operators', 'Waiting Staff', 'Company Secretaries', 'Art Direction', 'Teaching - Vocational', 'Estimating', 'Tour Guides', 'Help Desk & IT Support']",To perceive a career in renowned firm with dedicated efforts and to associate myself with an organization that gives me a chance to update my knowledge
c525 first name,c525 last name,c525@email.com,password,secondary,-33.89277157351995,151.308622071359,"['Teaching - Tertiary', 'Library Services & Information Management', 'Environmental Engineering', 'Supervisors/Team Leaders', 'Management - Area/Multi-site', 'Internal Communications', 'Company Secretaries', 'Computer Operators']",To leverage my expertise and experience in TIBCO software to assist the companies or corresponding outsourcers to integrate their systems and optimize their business processes
c526 first name,c526 last name,c526@email.com,password,tertiary,-33.89718382129128,151.42488495314507,"['All Banking & Financial Services ', 'Dental ', 'Clinical/Medical Research', 'COO & MD', 'Funds Management', 'Photography', 'Insolvency & Corporate Recovery', 'Company Secretaries']",To work for an organization which provides me the opportunity to improve my skills and knowledge to growth along with the organization objective
c527 first name,c527 last name,c527@email.com,password,none,-33.837781955171806,151.21804978221522,"['Architecture', 'Board Appointments', 'Retail & Property Development', 'Painters & Sign Writers']","To add value for the organization with the help of my interpersonal skills, adaptive nature, innovative skills and improve my professional skills as per the organizational requirements"
c528 first name,c528 last name,c528@email.com,password,PhD,-33.639481872721106,151.0234246992405,"['Other', 'Technicians ', 'Management - Schools', 'Other', 'Police & Corrections', 'Bar & Beverage Staff', 'Buying', 'Winery & Viticulture']",To take responsible and challenging position in the organization where my knowledge can be shared and enriched
c529 first name,c529 last name,c529@email.com,password,PhD,-33.670108199552146,151.32231985753884,"['All Banking & Financial Services ', 'Audit - External', 'Horticulture', 'Navy', 'Insurance & Superannuation Law', 'Water & Waste Engineering']","To work with a company which appreciates innovations so that, I can enhance my knowledge and skills to give my best for the growth of the company"
c530 first name,c530 last name,c530@email.com,password,tertiary,-34.0139990964182,150.9284171453115,"['Fishing & Aquaculture', 'Law Clerks & Paralegals', ""Workers' Compensation"", 'Building Services Engineering', 'Residential Sales', 'New Business Development']",To secure a challenging position where I can effectively contribute my skills as web developer for growth of organization and myself
c531 first name,c531 last name,c531@email.com,password,none,-33.89236051161721,151.52322042277407,"['All Administration & Office Support ', 'Business Services & Corporate Advisory', 'Oil & Gas - Production & Refinement', 'Treasury']",To work in a challenging environment demanding all my skills and efforts to contribute to the development of organization and myself with impressive performance
c532 first name,c532 last name,c532@email.com,password,secondary,-33.98911153918004,151.2421142864953,['Photography'],"To seek a challenging career where I can effectively apply my knowledge and develop skills in the fields of Finance, Costing, Taxation and Accounting and contribute to the growth of the organization"
c533 first name,c533 last name,c533@email.com,password,masters,-33.90035712266241,150.99183995464014,"['Teaching - Early Childhood', 'Health, Safety & Environment', 'Credit', 'Emergency Services', 'Oil & Gas - Production & Refinement', 'CEO']",To utilize and improve my technical skills and domain knowledge for achieving the target and delivering the best performance in the organization
c534 first name,c534 last name,c534@email.com,password,postgraduate,-33.80738190911184,150.96938400564892,"['Other', 'Litigation & Dispute Resolution', 'Other', 'All Insurance & Superannuation', 'Digital & Search Marketing', 'All Construction ', 'Mining - Drill & Blast', 'Team Leaders/Supervisors', 'All Banking & Financial Services ']",To work with a healthy environment with dedication and updating with day to day technologies for the growth of the Organization and self
c535 first name,c535 last name,c535@email.com,password,secondary,-33.85053143662079,151.18098773061783,"['Account & Relationship Management', 'Automotive Trades ', 'Management', 'Surveying', 'Graphic Design', 'Mining - Processing', 'Strategy & Planning', 'Management', 'Student Services']",To develop my career as a successful developer in an organization where I will be a valuable team member and there will be a scope for personal and organizational growth
c536 first name,c536 last name,c536@email.com,password,none,-33.87727675994206,150.98130783285288,"['Management - Vocational', 'Veterinary Services & Animal Welfare', 'Farm Labour', 'Management', 'Superannuation', 'Nursing - Midwifery, Neo-Natal, SCN & NICU', 'Analysis & Reporting', 'Programme & Project Management']","To be part of an organization where the process of learning never ends and every day is a challenge to learn, perform and deliver in order to facilitate the growth and development of the respective organization as well as an individual"
c537 first name,c537 last name,c537@email.com,password,PhD,-34.00304968377664,151.12579151656584,"['Assistant Accountants', 'Analysis & Reporting', 'Strategy & Planning']",To obtain challenging and responsible position in an organisation where in I contribute to the successful growth of an organisation using my abilities and knowledge
c538 first name,c538 last name,c538@email.com,password,masters,-33.78355174141983,151.1225735756909,"['Business Services & Corporate Advisory', 'Biotechnology & Genetics', 'Natural Resources & Water', 'Tutoring', 'Consultants', 'Farm Management', 'Clinical/Medical Research', 'Mining - Processing', 'Banking - Business']",To seek challenging position and dedicate my service to a company and contribute my talents and skills for the progress of organization which leads me to have the job satisfaction
c539 first name,c539 last name,c539@email.com,password,tertiary,-33.71861964513731,150.98842655683336,"['Management - Store ', 'Chemical Engineering', 'Cost Accounting', 'Payroll', 'Student Services', 'Air Force', 'All Advertising, Arts & Media', 'All Accounting ']",To secure a position in a challenging environment requiring innovation and to improve my individuality in team work and to be efficient contributor to the development of the industry
c540 first name,c540 last name,c540@email.com,password,postgraduate,-33.77759704991226,151.22037528011327,"['All Farming, Animals & Conservation ', 'Project Engineering', 'Compliance & Risk', 'Management', 'Other', 'Management', 'Rail & Maritime Transport', 'All CEO & General Management', 'Other', 'Intellectual Property Law']","To build career in a growing organization, where I can get the opportunities to prove my ability by accepting challenges, fulfilling the organization goal and climb the career ladder through continuous learning and commitment"
c541 first name,c541 last name,c541@email.com,password,none,-33.86030834496306,151.44535873017395,"['Event Management', 'Corporate & Commercial Law', 'Surveying']",To serve in organization where there is opportunity for utilizing my skills and upgrading my knowledge in the process of growth of the organization
c542 first name,c542 last name,c542@email.com,password,PhD,-33.80003649327752,151.35698578445317,['Management - Vocational'],To effectively utilize my skills in the field of engineering for the development of myself and for the company in which I am working with utmost dedication
c543 first name,c543 last name,c543@email.com,password,none,-33.89125063271823,151.2970205183095,['Financial Managers & Controllers'],To pursue a career in the technical industry as an efficient and dependable employee being resourceful to the organization and affable towards my colleagues
c544 first name,c544 last name,c544@email.com,password,secondary,-34.063852122950586,151.3653323500228,"['Analysis & Reporting', 'Management', 'Occupational Health & Safety', 'Customer Service - Call Centre', 'Generalists - In-house', 'Taxation']",To enroll myself in a workforce that is challenging enough to unleash the best out of me
c545 first name,c545 last name,c545@email.com,password,tertiary,-33.71503013477778,151.3323920615389,"['Other', 'Management - Universities', 'Sales - Outbound']",To secure a challenging position where I can effectively contribute my skills as software professional for growth of organization and myself
c546 first name,c546 last name,c546@email.com,password,tertiary,-34.051541328029515,150.99576314515716,"['Health, Safety & Environment']","To work in a challenging organization where I can keep learning, apply my inherent skills and knowledge towards aligning my personal goals to that the organization"
c547 first name,c547 last name,c547@email.com,password,none,-33.98852023949955,151.2739629706625,"['Surveying', 'Banking - Corporate & Institutional', 'Banking - Retail/Branch']",To pursue a career in an organization that gives me an opportunity to prove myself and helps in improving the horizons of my skills and abilities which enables me in scaling the heights of professional excellence and thus make a meaningful contribution to organizational goals
c548 first name,c548 last name,c548@email.com,password,PhD,-33.74759944509257,151.350623791157,"['Aged & Disability Support ', 'Direct Marketing & CRM']",To grow as a professional Engineer in professionally managed company where my capabilities are recognized and gives me opportunities for growth where I can lead to give quality solutions to the company
c549 first name,c549 last name,c549@email.com,password,tertiary,-33.784343305832955,151.52553820179315,"['Corporate Finance & Investment Banking', 'Civil/Structural Engineering', 'Carpentry & Cabinet Making ', 'Electrical/Electronic Engineering', 'Air Force', 'Other', 'Quality Assurance & Control']","To work in a result oriented, dynamic environment, providing ample opportunities for value addition to the organization and providing challenges, opportunities for sustained personal"
c550 first name,c550 last name,c550@email.com,password,masters,-33.936355488692286,151.04552866310837,"['Child Welfare, Youth & Family Services ', 'Machine Operators', 'Engineering - Software', 'Family Law', 'Sales - Pre & Post', 'Optical', 'Analysis & Reporting', 'Underwriting', 'Management Accounting & Budgeting', 'Banking & Finance Law']","To work on a challenging job profile which provides an opportunity to enhance my technical skills and knowledge, This could provide me an insight into new aspects so that it would be helpful for my career"
c551 first name,c551 last name,c551@email.com,password,tertiary,-33.698680776126224,151.45062699105088,"['Planning & Scheduling', 'Other', 'Settlements']",To work in a harmonious environment with a progressive organization that shall enable me to improve my skill sets and to achieve a career that indulges my passion for technology combined with an opportunity to apply my understandings of the same
c552 first name,c552 last name,c552@email.com,password,PhD,-33.74573124948884,151.00119422599658,"['Programming & Production', 'Security', 'Veterinary Services & Animal Welfare', 'Forensic Accounting & Investigation', 'Management', 'Journalism & Writing']","To become successful person, I want to work in an environment which would utilize my anylytical and technical skills"
c553 first name,c553 last name,c553@email.com,password,none,-33.77207089605457,151.45213866546823,['Process Engineering'],To be an astute learner and the best performer in your organization
c554 first name,c554 last name,c554@email.com,password,none,-33.899945439913495,151.38517778295684,"['All Farming, Animals & Conservation ', 'Policy', 'Strategy & Planning', 'Retail Assistants ', 'Programme & Project Management', 'Emergency Services', 'Farm Management', 'CEO', 'Gardening & Landscaping']",To work for an organization which provides me the opportunity to improve my skills and knowledge to growth along with the organization objective
c555 first name,c555 last name,c555@email.com,password,postgraduate,-33.69932819119361,151.16793898646844,"['Management - Agency', 'Winery & Viticulture', 'Project Management', 'Police & Corrections', 'Purchasing, Procurement & Inventory', 'Other', 'Industrial Design']",To achieve success in any task I undertake making full use of my personal and professional capabilities thereby benefiting the organization I work with
c556 first name,c556 last name,c556@email.com,password,none,-33.781598635891044,151.0199945358041,"['Other', 'Biotechnology & Genetics', 'Banking - Retail/Branch', 'Banking - Business']",To pursue a challenging career and be a part of progressive organization that gives a scope to enhance my knowledge and utilizing my skills towards the growth of the organization
c557 first name,c557 last name,c557@email.com,password,postgraduate,-34.015475098348695,151.45551580245575,"['Technicians ', 'Tax Law', 'Account & Relationship Management', 'Promotions', 'Web Development & Production', 'Corporate Development', 'Company Secretaries', 'Strategy & Planning', 'Other']",To administer and develop solution to produce the best outcome and to work towards the goal of organization
c558 first name,c558 last name,c558@email.com,password,postgraduate,-34.00296863002963,150.9553585072774,"['Mining - Engineering & Maintenance ', 'Machine Operators', 'Management Accounting & Budgeting', 'Childcare & Outside School Hours Care ', 'All Information & Communication Technology ', 'All Legal ', 'Workplace Training & Assessment', 'Volunteer Coordination & Support', 'Teaching Aides & Special Needs', 'Management']",To seek a challenging career in a high growing company with a competitive and challenging environment and utilize my experience and education to its full potential
c559 first name,c559 last name,c559@email.com,password,PhD,-33.977871934784524,151.06338509880356,"['Childcare & Outside School Hours Care ', 'Modelling & Simulation']",To work efficiently and passionately in a challenging environment for overall growth and to meet organizational goals and objectives
c560 first name,c560 last name,c560@email.com,password,none,-33.91197547780342,150.91207992273476,"['Receptionists', 'Administration', 'Speech Therapy', 'Other', 'Product Management & Development', 'Water & Waste Engineering']",To achieve a Challenging in the Industry and to use technical communication and interpersonal skills for the growth organization
c561 first name,c561 last name,c561@email.com,password,masters,-33.99418335660262,150.9707023991452,"['Management', 'Government - Local ', 'Nursing - High Acuity', 'Inventory & Fixed Assets', 'Management', 'Mechanical Engineering', 'Purchasing, Procurement & Inventory', 'Government - Federal ', 'Kitchen & Sandwich Hands', 'Taxation']",To build web applications to solve business problems
c562 first name,c562 last name,c562@email.com,password,postgraduate,-33.880218433177006,151.53311808355596,"['Nursing - General Medical & Surgical', 'Taxation']",To secure a job in the information technology and utilize my skills and knowledge for the benefit of the organization while achieving career growth
c563 first name,c563 last name,c563@email.com,password,masters,-34.07072031272286,151.35139635871766,"['Web Development & Production', 'Locksmiths', 'Machine Operators', 'Maintenance', 'Market Research & Analysis', 'Analysts', 'Welders & Boilermakers ', 'All Human Resources & Recruitment ', 'Nursing - Educators & Facilitators']","To frame a career that allows me to be compatible in any competitive environment and also boosts up my capacities, knowledge and energy to their positive full and a drive for self improvement with sincerity, dedication and smart work"
c564 first name,c564 last name,c564@email.com,password,masters,-33.64626587281339,151.2306150478327,"['Cleaning Services', 'Credit', 'Welders & Boilermakers ']","To work in a firm with professional work driven environment where I can apply knowledge, skills which enables me as a fresh graduate to grow and achieve personal as well as organizational goals"
c565 first name,c565 last name,c565@email.com,password,tertiary,-33.82374261733082,151.5552624052332,"['Supervisors/Team Leaders', 'Management', 'Farm Labour']","To work in a firm with a professional work driven environment where I can utilize and apply my knowledge, skills which would enable me as a fresh graduate to grow while fulfilling organizational goals"
c566 first name,c566 last name,c566@email.com,password,postgraduate,-33.86696654382434,151.51599782762318,"['Banking - Business', 'Plumbers', 'Nursing - Midwifery, Neo-Natal, SCN & NICU', 'Company Secretaries', 'Nursing - Management', 'Other']","To work in a competitive environment that effectively utilizes my analytical, interpersonal, leadership and organizational skills to conceive and achieve solutions"
c567 first name,c567 last name,c567@email.com,password,secondary,-33.83798627976782,151.3015923093103,"['Database Development & Administration', 'Front Office & Guest Services', 'Automotive Trades ', 'Management', 'Banking - Business', 'Conservation, Parks & Wildlife', 'Agency Account Management', 'Carpentry & Cabinet Making ', 'Management']","To work on a challenging job profile which provides an opportunity to enhance my technical skills and knowledge, This could provide me an insight into new aspects so that it would be helpful for my career"
c568 first name,c568 last name,c568@email.com,password,secondary,-33.7205599604917,151.12685572847627,"['Childcare & Outside School Hours Care ', 'Building Trades', 'Agency Account Management']",To work for an organization which provides challenging and an education working environment which would nature my knowledge and leverage my skills for organizational and personal perspective
c569 first name,c569 last name,c569@email.com,password,tertiary,-33.75450625331077,151.12192217995818,"['Other', 'Commercial Sales, Leasing & Property Mgmt', 'Process Engineering', 'Locksmiths', 'Aviation Services', 'Automotive Trades ', 'Sales - Outbound', 'Chefs/Cooks ']",To utilize my proficiency in an effective manner for a reputed organization that proves my creation and innovation for the organization
c570 first name,c570 last name,c570@email.com,password,tertiary,-33.699309080778974,151.43505808150164,"['Other', 'Telecommunications', 'Other', 'Management & Change Consulting', 'Testing & Quality Assurance', 'Couriers, Drivers & Postal Services', 'Graphic Design', 'All Accounting ', 'Interior Design', 'Banking & Finance Law']",To seek a career in a reputed organization that will help me to grow with the organization and to acquire new knowledge and skills apply my knowledge in that field
c571 first name,c571 last name,c571@email.com,password,masters,-33.97101626523428,151.10187476461047,"['All Human Resources & Recruitment ', 'Health, Safety & Environment', 'Other', 'Residential Leasing & Property Management', 'Security Services', 'Assessment', 'Training & Development', 'Electricians ', 'Buying']","To work in organisation where the skill, knowledge and enthusiasm is of high value"
c572 first name,c572 last name,c572@email.com,password,none,-33.72963604520816,151.45180864177053,"['Web & Interaction Design', 'Public Relations & Corporate Affairs', 'Help Desk & IT Support', 'Treasury', 'Government - Local ']",To become a successful professional in the field of Information Technology and to work in an innovative and competitive world and to grow with the company where I can effectively contribute my software skills as professional
c573 first name,c573 last name,c573@email.com,password,masters,-34.035216115853494,151.0391295792629,"['Community Services & Development', 'Nursing - Theatre & Recovery', 'Volunteer Coordination & Support', 'Customer Service - Customer Facing', 'Engineering - Hardware', 'Residents & Registrars', 'Property Law', 'Landscape Architecture']","To seek a challenging position in an IT industry and contribute extensively while being resourceful, innovative and flexible in an environment where there is opportunity for personal and professional growth"
c574 first name,c574 last name,c574@email.com,password,PhD,-34.0900812280177,151.21285538958304,"['Teaching - Early Childhood', 'All Mining, Resources & Energy ', 'Other', 'Buying', 'Nursing - A&E, Critical Care & ICU', 'Plumbers', 'Client & Sales Administration', 'Other']",To develop my career as a software engineer
c575 first name,c575 last name,c575@email.com,password,secondary,-33.78199080143606,151.420337084175,"['Contracts Management', 'Modelling & Simulation', 'Freight/Cargo Forwarding']",To administer and develop solution to produce the best outcome and to work towards the goal of organization
c576 first name,c576 last name,c576@email.com,password,secondary,-33.70512997424507,151.0184005035671,"['Analysis & Reporting', 'Labourers ', 'Account & Relationship Management', 'Teaching - Tertiary', 'Automotive Engineering', 'Environmental, Earth & Geosciences', 'Health, Safety & Environment']",To work in a challenging atmosphere by exhibiting my skills with at most sincerity and dedicated smart work for the growth of your esteemed organization along with mine
c577 first name,c577 last name,c577@email.com,password,PhD,-33.83100880419081,151.24370874140334,['Other'],To obtain a position which offers me a positive environment to learn new technologies and implement them in order to support the forces and also helps me in broadening and enhancing my current skills and knowledge
c578 first name,c578 last name,c578@email.com,password,masters,-33.73693894111973,150.9794303054383,"['All Construction ', 'Valuation', 'Management - Store ', 'Surveying', 'Workplace Training & Assessment', 'Analysis & Reporting', 'Accounts Payable', 'Environment & Planning Law', 'Community Services & Development', 'Mining - Exploration & Geoscience']","To secure a challenging position where, I can effectively contribute with my Technical skills"
c579 first name,c579 last name,c579@email.com,password,secondary,-33.872917016785706,151.49097377655028,"['Teaching Aides & Special Needs', 'Construction Law', 'Nursing - A&E, Critical Care & ICU', 'Mortgages', 'Project Management', 'Automotive Trades ', 'Medical Imaging', 'Analysts', 'Personal Injury Law']","To work in learning and challenging environment, utilizing my skill and knowledge to be the best of my abilities and contribute positively to my personal growth as well as growth of the organization"
c580 first name,c580 last name,c580@email.com,password,postgraduate,-33.751401511700806,150.94111225168766,['Environmental Services'],"To secure a challenging position in an esteemed organization, and expand my skills and experience by working alongside the best technologists in the industry"
c581 first name,c581 last name,c581@email.com,password,secondary,-34.11645405094252,151.27089339470578,"['Event Management', 'All Education & Training ', 'Housekeeping', ""Workers' Compensation"", 'Cost Accounting']","To obtain a challenging position in a progressive company, utilizing abilities developed through experience and education, with the opportunities for professional growth based on performance"
c582 first name,c582 last name,c582@email.com,password,tertiary,-33.81711161199107,151.28527176130237,"['Banking - Corporate & Institutional', 'Industrial & Employee Relations', 'Other', 'Other']",To work in a stimulating and challenging environment that would facilitate the maximum utilization and application of my broad skills and expertise in making a positive difference to the organization
