first_name,last_name,email,password,education,latitude,longitude,skills,description
c258 first name,c258 last name,c258@email.com,password,masters,-34.08746318864028,151.39522179970191,"['Bakers & Pastry Chefs', 'Student Services', 'Environmental, Earth & Geosciences', 'All Sales ', 'All Call Centre & Customer Service ']",To work for an organization which provides me the opportunity to improve my skills and knowledge to growth along with the organization objective
c259 first name,c259 last name,c259@email.com,password,none,-33.80168074918828,151.29451729171225,['Automotive Engineering'],To contribute to the organizations growth by being a team member and to devote my management and technical skills for attaining the organizational goals and maximizing personal learning
c260 first name,c260 last name,c260@email.com,password,secondary,-34.08772975947768,151.39677672006243,['Fashion & Textile Design'],"To achieve a challenging scenario where my abilities are put to test and my work has recognition and where my analytical, problem solving skills and application skills can be utilized to benefit the organization as well as to increase and enhance my knowledge"
c261 first name,c261 last name,c261@email.com,password,PhD,-33.81420297173059,151.1377583562951,"['Programming & Production', 'Health, Safety & Environment', 'Fashion & Textile Design', 'Biotechnology & Genetics', 'Natural Resources & Water', 'Front Office & Guest Services', 'Sales Coordinators', 'Interior Design', 'All Marketing & Communications ']","To make my career as a Software Engineer in a reputed industry, being a Software Engineer, would like to enhance my knowledge and grow along with the organization"
c262 first name,c262 last name,c262@email.com,password,none,-34.007789830454335,151.34968084735104,"['Surveying', 'Production, Planning & Scheduling', 'Other', 'Help Desk & IT Support', 'Modelling & Simulation', 'Art Direction']","To pursue a challenging education in Data Science and to thoroughly understand concepts of Computer Science, take up research in that area and contribute to the best of my abilities to the technological revolution"
c263 first name,c263 last name,c263@email.com,password,PhD,-33.70298925614733,151.0485002594348,"['Airlines', 'Student Services', 'All Manufacturing, Transport & Logistics ', 'Systems Engineering', 'Electrical/Electronic Engineering', 'Industrial Engineering', 'Agency Account Management', 'All Government & Defence ', 'All Advertising, Arts & Media', 'Systems Accounting & IT Audit']",To secure a position where I can associate myself with an organization where there is an opportunity to share and contribute my knowledge for development of self and organization served
c264 first name,c264 last name,c264@email.com,password,secondary,-33.86728176016439,151.524820573136,['Accounts Officers/Clerks'],"To achieve leading position in IT industry, wherein I can apply my skills and educational knowledge for the successful achievement of goals and growth of the organization"
c265 first name,c265 last name,c265@email.com,password,tertiary,-33.665596828341826,151.26803127565748,"['Promotions', 'Management - Universities', 'Assessment', 'Strategy & Planning', 'Engineering - Network', 'Gaming', 'Natural Therapies & Alternative Medicine', 'Records Management & Document Control', 'Systems Accounting & IT Audit', 'Superannuation']","To secure a challenging job position in an organization involving good decision making, aspire to excel in whatever work I do and make my contribution a lasting one"
c266 first name,c266 last name,c266@email.com,password,postgraduate,-33.836331170399326,151.18458320524613,"['General/Business Unit Manager', 'Other']",To acquire a challenging career and be a part of progressive organization that gives me the scope to enhance my knowledge and showcase my skills towards the growth of the organization
c267 first name,c267 last name,c267@email.com,password,masters,-33.958579180516416,151.53466650439938,"['Interior Design', 'Pickers & Packers', 'Sales - Outbound', 'All Science & Technology', 'Event Management', 'Consultants', 'Chemical Engineering', 'Hair & Beauty Services ']",To learn and work in an established company
c268 first name,c268 last name,c268@email.com,password,PhD,-33.69167132211346,151.4000101961029,"['Intellectual Property Law', 'Indigenous & Multicultural Services', 'Other', 'Gaming', 'Agronomy & Farm Services', 'Engineering Drafting', 'Waiting Staff', 'Security', 'Library Services & Information Management']",To work in challenging environment where I can utilise my knowledge and apply in real world to generate something new
c269 first name,c269 last name,c269@email.com,password,tertiary,-33.83282790765571,151.00553039599689,"['Actuarial', 'Waiting Staff', 'Other', 'Customer Service - Call Centre', 'Materials Handling Engineering', 'Air Force', 'Corporate Finance & Investment Banking']","To obtain a challenging position in a progressive company, utilizing abilities developed through experience and education, with the opportunities for professional growth based on performance"
c270 first name,c270 last name,c270@email.com,password,secondary,-33.729101004388234,151.01898314589653,"['Warehousing, Storage & Distribution ', 'Banking - Business']",To work in challenging atmosphere by exhibiting my skills with sincerity and dedicated smart work for the growth of your esteemed organization along with mine
c271 first name,c271 last name,c271@email.com,password,tertiary,-34.09451561029776,151.25262994391122,"['Quality Assurance & Control', 'Management', 'All Science & Technology', 'Editing & Publishing', 'Management', 'Tailors & Dressmakers', 'All Accounting ']",To be a Successful Web Developer in respected company and to achieve and the objectives of the company with honesty and fairness and to continuously upgrade my knowledge and skills
c272 first name,c272 last name,c272@email.com,password,postgraduate,-33.80718551037039,151.24628002125385,['Other'],To learn and function effectively in an organization and be able to deliver to the bottom line
c273 first name,c273 last name,c273@email.com,password,postgraduate,-34.06292571165201,151.130151921459,"['Consulting & Generalist HR', 'Child Welfare, Youth & Family Services ', 'Programming & Production', 'Management', 'All Sales ', 'Other', 'Other', 'Management - Area/Multi-site']",To contribute my skills in a challenging environment of a professionally managed reputed Organization which offers significant responsibilities and opportunities for growth and move into higher technology areas which provide an environment to improve my technical and analytical abilities
c274 first name,c274 last name,c274@email.com,password,tertiary,-33.63593913569553,151.06723415399105,"['Management - Universities', 'Consultants', 'Training & Development', 'Valuation', 'Board Appointments', 'Rail & Maritime Transport', 'Product Management & Development', 'New Business Development', 'Engineering Drafting']","To embark a career in creative and challenging environments, which will enable me to deploy my professional, educational and functional talents in the best possible way to reach the goals of the organization, myself and the society as a whole"
c275 first name,c275 last name,c275@email.com,password,postgraduate,-33.82298750427914,151.26498421245637,"['Cost Accounting', 'Optical', 'Health, Safety & Environment', 'Sales - Inbound']",To work for a huge Multinational Global Enterprise to achieve the organisational goals with adoption of methodical approach towards the work assigned
c276 first name,c276 last name,c276@email.com,password,tertiary,-33.76842323279008,150.88653051726266,"['Fashion & Textile Design', 'Surveying', 'Nursing - Educators & Facilitators', 'Project Engineering', 'Security']","To progress in organization through dedication, Smart, hard work and delivering the best of my capabilities and to prove myself in the organization"
c277 first name,c277 last name,c277@email.com,password,tertiary,-34.037678243770834,151.3237504169766,['Art Direction'],To succeed in an environment of growth and excellence and earn a job which provides me job satisfaction
c278 first name,c278 last name,c278@email.com,password,PhD,-34.104306068079616,151.1682258884508,"['Web Development & Production', 'Optical', 'Technicians ', 'Team Leaders', 'Farm Labour', 'Government - State ', 'Product Management & Development', 'Aged & Disability Support ']",To work in pragmatic way in an organization where I can show my talent and enhance my skills to meet company goals and objective with full integrity and zest
c279 first name,c279 last name,c279@email.com,password,secondary,-33.85667257185213,151.02993881835107,"['Analysts', 'Psychology, Counselling & Social Work ', 'Other', 'Clinical/Medical Research', 'Teaching - Tertiary', 'Policy', 'Self Employment']","To obtain a position where my communication, leadership, managerial, computing, software and technical skill are utilized to its best"
c280 first name,c280 last name,c280@email.com,password,none,-33.76145973728988,151.10961663520376,"['Funds Management', 'Labourers ', 'Risk Consulting', 'Criminal & Civil Law', 'Chefs/Cooks ', 'Urban Design & Planning', 'Waiting Staff', 'All Advertising, Arts & Media', 'Market Research & Analysis', 'Mechanical Engineering']",To secure a challenging position in an organization that utilizes my engineering and analytical skills in overall growth of that organization
c281 first name,c281 last name,c281@email.com,password,none,-34.01976334161614,151.43071470796025,"['Modelling & Simulation', 'Financial Planning']",To work for an organization which provides me the opportunity to improve my skills and knowledge to growth along with the organization objective
c282 first name,c282 last name,c282@email.com,password,tertiary,-34.02981134795296,151.08161856284698,"['Travel Agents/Consultants', 'All CEO & General Management', 'Testing & Quality Assurance', 'Security Services', 'Project Engineering']",To achieve a challenging position to work in an environment where performance is rewarded by utilizing my caliber
c283 first name,c283 last name,c283@email.com,password,none,-33.93073072147407,151.28849585612915,"['Nursing - Aged Care ', 'Locksmiths', 'Management - Internal', 'All Marketing & Communications ', 'Mechanical Engineering']","To seek the challenging position in software industry that needs innovation, creativity, dedication and enable me to continue to work in a challenging environment, leveraging my current knowledge"
c284 first name,c284 last name,c284@email.com,password,secondary,-33.77560910147229,151.37886258469163,['Training & Development'],To work in a challenging and creative atmosphere where I can upgrade my skills and use my creative ability
c285 first name,c285 last name,c285@email.com,password,none,-33.71282754259614,151.4254951677594,"['Buying', 'Air Conditioning & Refrigeration', 'Freight/Cargo Forwarding', 'Materials Sciences', 'Environment & Planning Law']",To work and contribute to my fullest potential in a progressive organization where I can continue to learn and acquire skills that would benefit me and the organization
c286 first name,c286 last name,c286@email.com,password,tertiary,-34.00194127959786,151.24638041778186,"['Chefs/Cooks ', 'Student Services', 'Pharmaceuticals & Medical Devices', 'Management', 'Construction Law', 'Management - Internal', 'Nursing - Aged Care ']","To work in a challenging environment, utilizing my skill, knowledge and expertise to the best of my abilities and contribute positively to my personal growth as well as growth of the organization"
c287 first name,c287 last name,c287@email.com,password,secondary,-33.840189842349695,151.04811362784787,"['Student Services', 'Body Corporate & Facilities Management', 'Mining - Exploration & Geoscience']","To be associated with progressive organization that gives me scope to update my skills as well as to work in a healthy, innovative and challenging environment extracting the best out of me, which is to learn and grow at both professional and personal level thereby directing my future as an assets to the organization and to be a part of the team that dynamically works towards the growth of the organization"
c288 first name,c288 last name,c288@email.com,password,tertiary,-33.692158180872035,151.17971039939778,['Machine Operators'],"To earn an identity of a valuable asset to my organization and build a value driven, exemplary career in Global Information and Technology industry"
c289 first name,c289 last name,c289@email.com,password,postgraduate,-33.99097073222415,151.21701114010224,"['Project Engineering', 'Management', 'Pharmacy']",To take up a job that would offer me a platform for putting my strength to the best use and enhancing my skills set eventually and helping me to advance to a more suitable position in the Industry
c290 first name,c290 last name,c290@email.com,password,masters,-33.95241875915858,150.90198508404683,"['Strategy & Planning', 'Corporate Finance & Investment Banking', 'Customer Service - Call Centre', 'Data Entry & Word Processing', 'Nursing - Community, Maternal & Child Health', 'Digital & Search Marketing', 'Farm Labour', 'Brand Management']",To associate with the market leader as an Application Support personnel wherein I have the privilege to work efficiently and be a part of the success story in the long run
c291 first name,c291 last name,c291@email.com,password,masters,-34.06817143797358,151.10717766963944,"['Tutoring', 'Sales - Pre & Post']",To work for an organization which provides me the opportunity to use my past experience and improve my skill and knowledge for growth along with the organization objective
c292 first name,c292 last name,c292@email.com,password,masters,-33.78515099078839,151.33381360307436,['Performing Arts'],"To work in learning and challenging environment, utilizing my skills and knowledge to the best of my abilities and contribute positively to my personal growth as well as growth of the organization"
c293 first name,c293 last name,c293@email.com,password,secondary,-33.96995657854022,150.98762572807775,"['Web Development & Production', 'Architects', 'All Administration & Office Support ', 'Risk Consulting', 'Horticulture', 'Illustration & Animation']",To work in pragmatic way in an organization where I can show my talent and enhance my skills to meet Company goals and objectives with full integrity and zest
c294 first name,c294 last name,c294@email.com,password,postgraduate,-33.7251095295075,150.98606734952676,"['Market Research & Analysis', 'General Practitioners', 'Sales - Pre & Post']",To be professionally associated with an extern organization with an objective to accept challenges and work hard towards achieving goals of organization and self
c295 first name,c295 last name,c295@email.com,password,masters,-33.88889069378646,151.23850844551737,"['Other', 'Other', 'Food Technology & Safety', 'Urban Design & Planning']","To learn new things, implement my knowledge in practical life, and to provide my best to achieve goals of myself and my company"
c296 first name,c296 last name,c296@email.com,password,secondary,-34.051639953182075,151.3840394723493,"['Surveying', 'Promotions', 'Banking - Business', 'COO & MD', 'Audit - External', 'Valuation', 'Management', 'Other']",To work in a highly competitive environment with a perfect challenge by contributing the best for the growth of the organization while ensuring growth in personal career
c297 first name,c297 last name,c297@email.com,password,PhD,-33.65327844399006,151.11115559475996,"['Assessment', 'Police & Corrections', 'Maintenance']","To secure a challenging position where I can effectively contribute my skills, possessing competent technical skills"
c298 first name,c298 last name,c298@email.com,password,none,-34.01954208020798,151.05780374779783,['Winery & Viticulture'],"To become a successful professional in the field of Android development in IT sector, and to work in an innovative and competitive company"
c299 first name,c299 last name,c299@email.com,password,masters,-33.91641047209676,151.14680200820723,"['Oil & Gas - Drilling', 'Nannies & Babysitters']",To obtain a position where my knowledge can be utilized and expanded
c300 first name,c300 last name,c300@email.com,password,masters,-33.92613802679927,151.34497422112426,"['Machine Operators', 'Programming & Production', 'Analysts', 'PA, EA & Secretarial', 'Direct Marketing & CRM', 'Landscape Architecture']","To serve the pharmaceutical industry with the skills that I have learned during my educational tenure and ultimately serve nation and mankind in the field of Healthcare, pharmaceuticals and research"
c301 first name,c301 last name,c301@email.com,password,secondary,-33.827822853962864,151.03808355638483,"['Oil & Gas - Operations', 'Recruitment - Internal', 'Tour Guides']",To seek a challenging positions in a company with an open energetic and vibrant both environment which provides for continuous learning and career growth
c302 first name,c302 last name,c302@email.com,password,PhD,-33.86291776258965,151.15236031906767,"['Employment Services', 'All CEO & General Management', 'Speech Therapy', 'Welders & Boilermakers ', 'General/Business Unit Manager', 'Recruitment - Agency', 'Child Welfare, Youth & Family Services ', 'Developers/Programmers ']",To be professionally associated with an extern organization with an objective to accept challenges and work hard towards achieving goals of organization and self
c303 first name,c303 last name,c303@email.com,password,masters,-33.78230999377032,151.1655027013171,['Performing Arts'],To secure a challenging position in my field of study where I can sharpen my skills to contribute for the growth of my company and for achieving a brighter career
c304 first name,c304 last name,c304@email.com,password,secondary,-34.04483139329405,151.00264178682502,"['Criminal & Civil Law', 'Other', 'Automotive Engineering', 'Surveying', 'Client & Sales Administration']","To be a part of a renowned organization and utilize my experience, communication and interpersonal skills so as to work as a good team member in the growth and development of the organization"
c305 first name,c305 last name,c305@email.com,password,tertiary,-33.70516743508128,150.96300189871178,"['Process Engineering', 'Photography', 'Environment & Planning Law', 'Water & Waste Engineering']","To achieve professional growth while being resourceful, innovative and flexible and work in an innovative and competitive world where I can effectively contribute my skills to deliver my potential and make best use of my efforts to contribute towards the growth of an organization"
c306 first name,c306 last name,c306@email.com,password,masters,-33.75534681377259,150.99461077019947,"['Management', 'Urban Design & Planning', 'Customer Service - Customer Facing', 'Medical Specialists', 'Brokerage', 'Company Secretaries', 'Technicians ']",To join a stable organization where my skills are valued and which can help me grow in my career
c307 first name,c307 last name,c307@email.com,password,masters,-33.92548585835276,150.91777581841737,"['Project Engineering', 'Residential Leasing & Property Management', 'All Insurance & Superannuation', 'Management - Vocational', 'Health, Safety & Environment', 'Other', 'Product Management & Development']","To work as an efficient employee, giving optimum output in achieving the goal of the Organization towards success, by contributing knowledge and professional work attitude"
c308 first name,c308 last name,c308@email.com,password,PhD,-33.75551283966108,151.17345998203737,"['Analysts', 'Project Engineering', 'Materials Handling Engineering', 'Industrial & Employee Relations', 'Mechanical Engineering', 'Nursing - Paediatric & PICU', 'Telecommunications', 'Risk Consulting', 'Management', 'Receptionists']",To become a successful professional engineer and to work in an organization where my educational and creative skills can be applied for its benefits and my knowledge can be enriched and advanced technologies
c309 first name,c309 last name,c309@email.com,password,PhD,-33.93335839795737,151.4219053171448,"['Management ', 'Teaching Aides & Special Needs', 'Personal Injury Law', 'Other', 'Pickers & Packers', 'Government - Local ', 'Banking - Business', 'Architecture', 'All Manufacturing, Transport & Logistics ', 'Conservation, Parks & Wildlife']",To obtain a position in your esteemed organization so that I can work under highly experienced professionals and upgrade my knowledge and skills about the industry and work for benefit of the organization
c310 first name,c310 last name,c310@email.com,password,tertiary,-33.6960200077126,150.9867005928964,"['Payroll', 'Customer Service - Call Centre', 'Other', 'Technical Writing']",To work in the most challenging position with an organization that provides ample opportunities to learn and to contribute
c311 first name,c311 last name,c311@email.com,password,none,-33.866580731159345,151.3631273914152,"['Community Development', 'Oil & Gas - Production & Refinement']","To Start and Build a career in field of Electronics and Telecommunication Engineering with my Confidence, Motivation and Hardworking Skills"
c312 first name,c312 last name,c312@email.com,password,PhD,-33.84591966636184,151.2627060684462,"['All Insurance & Superannuation', 'Health, Safety & Environment', 'Teaching - Tertiary', 'Other', 'Editing & Publishing', 'Surveying']",To secure a challenging and rewarding position as Android Developer with an established organization that can utilize my skills and experience
c313 first name,c313 last name,c313@email.com,password,none,-33.804911725957496,150.94038264361276,"['Other', 'Sales Coordinators', 'Other', 'Other']",To work in an innovative and challenging environment wherein I can use my potential and knowledge for benefit of organization and myself
c314 first name,c314 last name,c314@email.com,password,tertiary,-34.01280438606032,151.09563900253485,"['Biological & Biomedical Sciences', 'Customer Service - Call Centre']","To work in an organization where I can utilization my knowledge, skills and ability to enhance my complete potential in order to grow and meet the challenges of competitive environment and work professionally"
c315 first name,c315 last name,c315@email.com,password,masters,-34.113000952940254,151.30681565841002,"['Teaching - Secondary', 'Purchasing, Procurement & Inventory', 'Analysis & Reporting', 'Nursing - Psych, Forensic & Correctional Health', 'Trade Marketing']",To work in a creative and competitive environment rendering my potentials and skills to the maximum and keep learning through working for the growth of the company and growing along with it
c316 first name,c316 last name,c316@email.com,password,tertiary,-34.11440065700201,151.18067074999266,"['Speech Therapy', 'Fitness & Personal Training', 'Supervisors', 'Labourers ', 'Nursing - General Medical & Surgical']",To gain employment with a company that offers me a consistently positive atmosphere to learn new technologies and implement them for the betterment of the business
c317 first name,c317 last name,c317@email.com,password,tertiary,-34.08517150969022,151.39584185438244,"['Training & Development', 'Optical', 'Mining - Exploration & Geoscience']",To work for an organization which provides me the opportunity to improve my skills and knowledge to growth along with the organization objective
c318 first name,c318 last name,c318@email.com,password,tertiary,-33.929816396945796,150.98020811674786,"['Aviation Services', 'All Human Resources & Recruitment ']",To work with an organization which stimulates creativity and learning so that I can contribute to organization growth and at the same time continuously Improve my efficiency and knowledge
c319 first name,c319 last name,c319@email.com,password,masters,-33.91554084990584,151.54460185934343,"['Buying', 'Dental ', 'Marketing Communications', 'Pickers & Packers', 'Sales Coordinators', 'Aged & Disability Support ', 'Oil & Gas - Exploration & Geoscience', 'Management - Schools']",To obtain a challenging position as a software developer in a leading company where I can utilize my analytical abilities and technical skills for development of the organization
c320 first name,c320 last name,c320@email.com,password,none,-33.88137659003192,150.86600822922475,"['Chiropractic & Osteopathic', 'Medical Imaging', 'Analysis & Reporting', 'Banking - Retail/Branch', 'Assessment', 'Laboratory & Technical Services', 'Other', 'Customer Service - Call Centre']",To deliver the best efforts to produce better results in the environment which encourages professionalism by updating knowledge and skills according to latest trends in the organization and economy
c321 first name,c321 last name,c321@email.com,password,secondary,-34.06258052769008,151.20701439820638,"['Building Services Engineering', 'Actuarial', 'Illustration & Animation', 'Other', 'Freight/Cargo Forwarding', 'Other', 'Carpentry & Cabinet Making ', 'Audit - External', 'Contracts Administration']",To work with an organization which stimulates creativity and learning so that I can contribute to organization growth and at the same time continuously Improve my efficiency and knowledge
c322 first name,c322 last name,c322@email.com,password,postgraduate,-34.10689844883341,151.14250789041574,"['Performing Arts', 'Mining - Processing', 'Public Relations & Corporate Affairs', 'All Sales ', 'Nursing - Management', 'Data Entry & Word Processing', 'Landscape Architecture', 'Other', 'Industrial Engineering', 'Dieticians']",To pursue an intellectual and challenging career that synergies conceptual skills with the practical insights required to enhance my talent with smart work and determination to grow as a highly qualified professional
