first_name,last_name,email,password,education,latitude,longitude,skills,description
c0 first name,c0 last name,c0@email.com,password,secondary,-33.934720720585986,151.35565976075236,"['Management', 'Floristry', 'Management', 'Management', 'Chiropractic & Osteopathic']","To seek a position in a well established Organization that offers room for professional growth, as this provides me ample opportunities to exhibit my skills and competencies in the chosen field"
c1 first name,c1 last name,c1@email.com,password,PhD,-33.761601371196875,151.10893184093854,"['Graphic Design', 'Dental ', 'Construction Law', 'Supervisors/Team Leaders', 'Marketing Communications', 'Landscape Architecture', 'Buying', 'Management - Store ', 'Banking - Business']",To associate myself with an organization that provides me an opportunity to show my skills
c2 first name,c2 last name,c2@email.com,password,PhD,-34.070531230224475,151.38598506334722,"['Graphic Design', 'Other', 'Criminal & Civil Law', 'All Hospitality & Tourism ', 'Gaming', 'Oil & Gas - Production & Refinement', 'Art Direction']","To secure a challenging position in an esteemed organization, and expand my skills and experience by working alongside the best technologists in the industry"
c3 first name,c3 last name,c3@email.com,password,masters,-33.7573087594467,150.89937467191842,"['Pharmacy', 'Pharmaceuticals & Medical Devices', 'Financial Accounting & Reporting', 'Nursing - Theatre & Recovery', 'Oil & Gas - Engineering & Maintenance', 'Other', 'Waiting Staff', 'Accounts Receivable/Credit Control', 'Machine Operators']","To work in a firm with a professional work driven environment where I can utilize and apply my knowledge, skills which would enable me as a fresh graduate to grow while fulfilling organizational goals"
c4 first name,c4 last name,c4@email.com,password,none,-33.80172174717854,151.0700368938808,"['Other', 'Photography', 'Automotive Engineering', 'Forensic Accounting & Investigation', 'Fundraising', 'Account & Relationship Management']","To obtain a position where my communication, leadership, managerial, computing, software and technical skill are utilized to its best"
c5 first name,c5 last name,c5@email.com,password,tertiary,-33.92716909690569,151.08832713675838,"['Farm Management', 'Fitters, Turners & Machinists']","To work in a firm with a professional work driven environment where I can utilize and apply my knowledge, skills and abilities to the growth of the organization and build my professional career"
c6 first name,c6 last name,c6@email.com,password,none,-33.8540600795062,151.55362834072386,"['Rail & Maritime Transport', 'COO & MD', 'Teaching - Secondary', 'Management', 'Consulting & Strategy', 'Ambulance/Paramedics', 'Other', 'Taxation']",To deliver consistent results with proficiency and commitment
c7 first name,c7 last name,c7@email.com,password,tertiary,-33.77194804807759,151.42011307720674,"['Conservation, Parks & Wildlife', 'Systems Engineering', 'Import/Export & Customs']",To work in a challenging environment demanding all my skills and adapt myself in different fields for the development of the organization with impressive performance
c8 first name,c8 last name,c8@email.com,password,masters,-33.90124451091791,150.91138902937223,"['Other', 'All Mining, Resources & Energy ', 'Audit - External', 'Mining - Exploration & Geoscience', 'Accounts Payable', 'All Design & Architecture', 'Child Welfare, Youth & Family Services ']","To survive in compitative and fast changing professional environments with the academically acquired knowledge, skills and confidence"
c9 first name,c9 last name,c9@email.com,password,tertiary,-33.69027304376075,151.27657147083318,"['Painters & Sign Writers', 'Residential Sales', 'Analysis & Reporting', 'Government - State ', 'Account & Relationship Management', 'Insurance & Superannuation Law', 'Pharmaceuticals & Medical Devices', 'Student Services', 'Law Clerks & Paralegals']",To work in an organization where I can learn continuously while contributing to the growth of the organization with total dedication and commitment towards work
c10 first name,c10 last name,c10@email.com,password,secondary,-34.052169740228045,150.96684741792615,"['Mining - Engineering & Maintenance ', 'All Marketing & Communications ', 'Digital & Search Marketing', 'Client & Sales Administration', 'Training & Development', 'Airlines', 'All Consulting & Strategy', 'Risk Consulting', 'Art Direction', 'Architectural Drafting']","To frame a career that allows me to be compatible in any competitive environment and also boosts up my capacities, knowledge and energy to their positive full and a drive for self improvement with sincerity, dedication and smart work"
c11 first name,c11 last name,c11@email.com,password,masters,-33.857889631251545,151.47494945994413,"['Mining - Exploration & Geoscience', 'Planning & Scheduling', 'Management - Internal', 'Event Management', 'Pickers & Packers', 'Management', 'Bar & Beverage Staff']",To work in an organization where I can contribute with my skills and abilities in the growth of the organization as well as where I can build my professional career
c12 first name,c12 last name,c12@email.com,password,tertiary,-33.82311427109854,151.21987223404534,"['Other', 'Road Transport ', 'Market Research & Analysis', 'Supervisors', 'Management', 'Fitters, Turners & Machinists', 'Banking - Business']","To work in learning and challenging environment, utilizing my skills and knowledge to be the best of my abilities and contribute positively to the growth of the organization"
c13 first name,c13 last name,c13@email.com,password,none,-34.062799234839076,151.29960762249704,"['Taxation', 'Corporate Finance & Investment Banking', 'Accounts Officers/Clerks', 'Community Development', 'Sales - Pre & Post']",To pursue a challenging career and be a part of progressive organizationthatgives ascope to enhance my knowledge and utilizing my skills towards the growthof the organization
c14 first name,c14 last name,c14@email.com,password,masters,-33.73218170891956,150.97291289067874,"['Navy', 'Retail Assistants ']","To work in a challenging environment, utilizing my skill, knowledge and expertise to the best of my abilities and contribute positively to my personal growth as well as growth of the organization"
c15 first name,c15 last name,c15@email.com,password,PhD,-33.85409319892812,151.34240343933232,"['Other', 'Cost Accounting', 'All Information & Communication Technology ', 'Winery & Viticulture', 'Audit - External', 'Couriers, Drivers & Postal Services', 'Travel Agents/Consultants']",To prove myself in a challenge position of responsibility that would stimulate and sharpen my skill and Establish me as a valuable assets to the organization
c16 first name,c16 last name,c16@email.com,password,PhD,-34.05810116078082,151.13146170560972,"['Agronomy & Farm Services', 'Engineering - Network', 'Labourers ', 'Other', 'Other']",To build a successful career and to work with committed and dedicated people in an innovative and competitive world which will help me to explore myself and to take a challenging role to the best of my skills and realize my potential
c17 first name,c17 last name,c17@email.com,password,secondary,-33.660650707421766,150.9915988068562,"['Product Management & Development', 'Teaching - Tertiary', 'Other', 'Other']","To Excel and pride in an organization which offers challenging work environment and growth in the areas of Software Development to become skilled software professional through hard work, commitment and adaptability to changes, rewarding and provides an opportunity to expand my knowledge and abilities in creating client centric solutions"
c18 first name,c18 last name,c18@email.com,password,postgraduate,-34.08052616280449,151.14250918807568,"['Marketing Assistants/Coordinators', 'All Healthcare & Medical ', 'Workplace Training & Assessment', 'Consulting & Strategy', 'Organisational Development', 'Winery & Viticulture']",To obtain a position in a company where I can make use of my skills to advance my professional career along with the organization objective
c19 first name,c19 last name,c19@email.com,password,none,-33.791899797336384,151.2883973969873,"['Management', 'Trade Marketing', 'Taxation']",To be an astute learner and the best performer in the IT industry
c20 first name,c20 last name,c20@email.com,password,masters,-33.85242732302996,151.00175602492828,"['Direct Marketing & CRM', 'Nursing - Community, Maternal & Child Health']",To achieve a promising career in technical sector where my subject abilities and personal skills can be exploited to benefit the organization and at the same time to succeed a growth oriented career platform
c21 first name,c21 last name,c21@email.com,password,tertiary,-34.00987532341068,151.16945795549773,"['Team Leaders/Supervisors', 'Other', 'Management - Store ', 'Corporate Finance & Investment Banking', 'Management - Schools', 'Management - Universities', 'Landscape Architecture']",To pursue a career that enables me to work and learn in a real professional ambience with scope for widening the spectrum of my knowledge and skills
c22 first name,c22 last name,c22@email.com,password,PhD,-33.80554300817974,151.48066471493237,"['Customer Service - Customer Facing', 'Environmental Engineering']","To seek a job in IT industry where I can utilize my communication skills, smart working ability, fresh thoughts and assertive behavior, to benefit the organization and contribute substantially to its development"
c23 first name,c23 last name,c23@email.com,password,tertiary,-33.909227923697586,151.33322154351012,"['Chiropractic & Osteopathic', 'Machine Operators', 'Gardening & Landscaping', 'Remuneration & Benefits', 'Warehousing, Storage & Distribution ', 'Indigenous & Multicultural Services', 'Project Management', 'Teaching Aides & Special Needs', 'Oil & Gas - Operations', 'Air Force']",To obtain a position that will allow me to utilize my technical skills and willingness to contribute and learn in making an organization successful
c24 first name,c24 last name,c24@email.com,password,none,-33.91393864106941,151.11863955958154,"['Library Services & Information Management', 'Veterinary Services & Animal Welfare']",To seek a challenge position in dynamic organization with passion and dedication in any kind of situation where I can prove my skills and knowledge with perfection
c25 first name,c25 last name,c25@email.com,password,none,-33.85540032535856,151.55650912716197,"['Planning', 'Other', 'PA, EA & Secretarial', 'Inventory & Fixed Assets', 'Credit', ""Workers' Compensation"", 'Commercial Sales, Leasing & Property Mgmt', 'Brokerage', 'Carpentry & Cabinet Making ', 'Architectural Drafting']","To be ever learning, energetic engineering professional, eager to excel in an equally dynamic organization, with an aim to actualize success for both an organization and for self"
c26 first name,c26 last name,c26@email.com,password,none,-33.852125810324466,151.2092905231708,"['Farm Management', 'Claims', 'All Science & Technology', 'Childcare & Outside School Hours Care ', 'Team Leaders/Supervisors']","To work in a professional organization, which provides not only a highly competitive and challenging atmosphere but also provides good opportunities for growth and development"
c27 first name,c27 last name,c27@email.com,password,postgraduate,-33.776721126871074,151.41281660293654,['Help Desk & IT Support'],"To enhance my working capacities, professional skills, business efficiencies and to serve my organization in best possible way with sheer determination and commitment"
c28 first name,c28 last name,c28@email.com,password,postgraduate,-33.74581099047394,151.419969358519,"['Industrial & Employee Relations', 'Testing & Quality Assurance', 'Compliance & Risk', 'Sales - Pre & Post']","To live honest and hard life in challenging environment, I intend to play a key role in Organization Growth with committed and dedicated people"
c29 first name,c29 last name,c29@email.com,password,tertiary,-33.907079418155824,151.20754339163602,"['All Information & Communication Technology ', 'Medical Imaging', 'Audit - Internal', 'Other']",To work for the organization to the best of my knowledge and ability from where the organization could benefit from my services and provide me with knowledge that are professionally important to me
c30 first name,c30 last name,c30@email.com,password,tertiary,-33.781836965314355,151.0469931700039,"['All Design & Architecture', 'Government - Local ', 'Field Engineering', 'All Self Employment', 'Technical Writing', 'Legal Secretaries', 'Warehousing, Storage & Distribution ', 'Production, Planning & Scheduling', 'Programme & Project Management', 'Sales']",To gain employment with a company that offers me a consistently positive atmosphere to learn new technologies and implement them for the betterment of the business
c31 first name,c31 last name,c31@email.com,password,postgraduate,-33.769108127293656,151.41586874992194,"['Analysts', 'Agency Account Management']",To secure a challenging position where I can effectively contribute my skills as Software Engineer
c32 first name,c32 last name,c32@email.com,password,none,-33.87140605683089,150.8820055821345,"['Illustration & Animation', 'Environmental Engineering']",To gain new experience and utilize my interpersonal skills to achieve goals
c33 first name,c33 last name,c33@email.com,password,postgraduate,-34.0125701296245,151.17818183516377,"['Accounts Receivable/Credit Control', 'Agronomy & Farm Services', 'All Education & Training ', 'Management', 'Building Services Engineering']",To get hold of a challenging career with a solid company utilizing the chance to offer proven and developing skills inside the company
c34 first name,c34 last name,c34@email.com,password,tertiary,-33.87864910295057,151.4838460455469,"['Remuneration & Benefits', 'Performing Arts', 'Materials Sciences', 'Architecture']",To secure a challenging career and lead a responsible role in your esteemed company and serve the organization with commitment and sincerity
c35 first name,c35 last name,c35@email.com,password,secondary,-33.90617190626631,151.4688587865109,"['Machine Operators', 'Volunteer Coordination & Support', 'Industrial & Employee Relations', 'Audit - External', 'All Real Estate & Property ', 'Developers/Programmers ', 'Recruitment - Internal', 'Strategy & Planning', 'Security', 'Nursing - Community, Maternal & Child Health']",To be a part of an organisation where I can fully utilize my skills and make a significant contribution to growth of organisation and at the same time enhance my experience through continuous learning
c36 first name,c36 last name,c36@email.com,password,none,-33.98945442630896,151.42210703756862,"['Oil & Gas - Engineering & Maintenance', 'Management', 'All Marketing & Communications ', 'General/Business Unit Manager', 'Taxation', 'Administrative Assistants ', 'Systems Engineering', 'Army']",To grow as a writer and an editor by working with a reputed media company and contribute to the growth of that organisation
c37 first name,c37 last name,c37@email.com,password,masters,-33.97017304489511,151.32660741800092,"['Assessment', 'Funds Management', 'Other', 'General Practitioners', 'Database Development & Administration', 'Management', 'Other', 'Other', 'Quality Assurance & Control']",To work in a progressive and challenging environment that will effectively utilize my strong organizational skills and educational background and enable me to make positive contribution to the work
c38 first name,c38 last name,c38@email.com,password,none,-33.752006373894986,151.18564538852922,"['Other', 'Personal Injury Law', 'Administration', 'All CEO & General Management']","To obtain a responsible, challenging, and awarding position in a web developer organization with an established track record where my skills, abilities, and technical abilities can be utilized"
c39 first name,c39 last name,c39@email.com,password,secondary,-34.11078140337817,151.1707615109579,['Surveying'],To pursue a highly challenging career where I can contribute my knowledge and hone my skills
c40 first name,c40 last name,c40@email.com,password,masters,-33.92784016209088,150.8869213722663,"['Generalists - Law Firm', 'Direct Marketing & CRM', 'Product Management & Development', 'Bakers & Pastry Chefs', 'Banking - Retail/Branch', 'Management', 'All Self Employment', 'Other']",To seek highly challenging and satisfying career with exposure and at the same time seek environment where my skills and loyalty will be rewarded with career advancement and guidance
c41 first name,c41 last name,c41@email.com,password,masters,-33.849072245868754,150.9864553486975,"['Strategy & Planning', 'Management - Internal', 'All Information & Communication Technology ']",To be an astute learner and the best performer in the IT industry
c42 first name,c42 last name,c42@email.com,password,secondary,-34.01497601380192,151.48684226221297,"['Direct Marketing & CRM', 'Data Entry & Word Processing', 'Pattern Makers & Garment Technicians', 'Architects', 'Mortgages', 'Recruitment - Internal', 'Recruitment - Agency', 'Product Management & Development']",To obtain a position of responsibilities that utilizes my skills and keen to work in an environment where I can enrich my knowledge and establish my own identity
c43 first name,c43 last name,c43@email.com,password,PhD,-33.86954032065721,150.99266124704505,"['Illustration & Animation', 'Media Strategy, Planning & Buying', 'Commercial Sales, Leasing & Property Mgmt', 'Biological & Biomedical Sciences', 'Building Services Engineering', 'Financial Planning', 'Industrial & Employee Relations']",To secure a challenging position that utilizes my academics skills and contributes to the overall growth of the organization
c44 first name,c44 last name,c44@email.com,password,tertiary,-33.800103651133654,151.0019058255624,"['Engineering Drafting', 'Planning & Scheduling', 'Physiotherapy, OT & Rehabilitation ', 'Volunteer Coordination & Support', 'Systems Engineering', 'Retail & Property Development']","To start my career in a competitive environment, where I can put all my skills to the best possible use and also constantly improve my capabilities and do the best for the company in which ever job allotted to me"
c45 first name,c45 last name,c45@email.com,password,masters,-33.917947290919,150.96923284677283,"['Management', 'Engineering - Hardware', 'Editing & Publishing']","To work in a result oriented, dynamic environment, providing ample opportunities for value addition to the organization and providing challenges, opportunities for sustained personal"
c46 first name,c46 last name,c46@email.com,password,masters,-34.1121645694527,151.22443984874664,"['Trade Marketing', 'Planning', 'Teaching - Secondary', 'Collections', 'Other', 'Ambulance/Paramedics', 'Other', 'Interior Design', 'Family Law', 'Nursing - General Medical & Surgical']",To work in an organization where I could utilize the oppurtunities and encourages me to enhance my personal and organizational goals
c47 first name,c47 last name,c47@email.com,password,postgraduate,-33.68140140630146,150.96852626713104,"['Building Trades', 'Computer Operators', 'Collections', 'Administration', 'Illustration & Animation', 'Materials Sciences', 'Other', 'Reservations']",To contribute meaningful growth and success of the organization by undertaking challenging assignment and deliver timely result using my knowledge and skill
c48 first name,c48 last name,c48@email.com,password,secondary,-33.714529912581256,151.35508482200143,"['Criminal & Civil Law', 'Contracts Administration', 'Retail & Property Development']","To prove myself dedicated and energetic as an employee in a progressive organization where it gives more scope to apply my knowledge and skills and be a member of a team, which dynamically works towards success and growth of an organization"
c49 first name,c49 last name,c49@email.com,password,PhD,-33.62809545807822,151.37350991217525,"['Architecture', 'Plant & Machinery Operators ', 'Analysis & Reporting', 'Self Employment', 'Security Services', 'Personal Injury Law', 'Audit - External', 'Photography']","To seek challenging assignment and responsibility, with an opportunity for growth and career advancement and successful achievements"
c50 first name,c50 last name,c50@email.com,password,PhD,-33.807880094486876,151.40400865531643,"['All Real Estate & Property ', 'Product Management & Development', 'General Practitioners', 'Testing & Quality Assurance', 'Purchasing, Procurement & Inventory']","To seek challenging assignment and responsibility, with an opportunity for growth and career advancement and successful achievements"
c51 first name,c51 last name,c51@email.com,password,postgraduate,-33.81263131791404,150.89408181320735,"['Other', 'Housing & Homelessness Services']",To utilize my technical skills for achieving the target and developing the best performance in the organization
c52 first name,c52 last name,c52@email.com,password,none,-33.952382184437006,151.36396171363924,"['Commercial Sales, Leasing & Property Mgmt', 'Reservations']","To pursue a career in a leading and progressive organization offering opportunities wherein I can utilise my skills, knowledge and qualifications towards the growth of the organisation"
c53 first name,c53 last name,c53@email.com,password,tertiary,-33.846857141582,151.2326689566008,"['Client Services', 'Analysis & Reporting', 'Property Law']","To excel as a software engineer in a job that both challenges and inspires me, while pushing me to work to the best of my abilities and produce the highest quality work that I am capable of"
c54 first name,c54 last name,c54@email.com,password,secondary,-34.03539544017775,151.08773818618633,"['Management - Internal', 'Environmental Services', 'Other', 'Engineering - Hardware', 'Navy', 'Urban Design & Planning', 'Library Services & Information Management', 'Physiotherapy, OT & Rehabilitation ', 'Fund Administration', 'Nursing - Aged Care ']","To be a part of a growing company and build a career alongside well experienced, dedicated and sincere people and ignite my talents as an engineer"
c55 first name,c55 last name,c55@email.com,password,postgraduate,-33.85707678380919,151.11636480364348,"['Teaching - Tertiary', 'Generalists - In-house', 'Engineering - Hardware', 'Art Direction']","To work in a competitive environment that effectively utilizes my analytical, interpersonal, leadership and organizational skills to conceive and achieve solutions"
c56 first name,c56 last name,c56@email.com,password,postgraduate,-33.768578753879524,151.0819902687738,"['All Human Resources & Recruitment ', 'Taxation', 'All Design & Architecture', 'Other', 'Project Management', 'Body Corporate & Facilities Management', 'Medical Specialists', 'Web & Interaction Design', 'Electrical/Electronic Engineering']",To perceive a career in a renowned firm with dedicated efforts and to associate myself with an organization that gives me a chance to update my knowledge
c57 first name,c57 last name,c57@email.com,password,masters,-33.6991380098736,151.0925309869498,"['New Business Development', 'Other', 'Legal Practice Management', 'Graphic Design', 'Technicians ', 'Welders & Boilermakers ']","To work in a firm with a professional work driven environment where I can utilize and apply my knowledge, skills which would enable me as a fresh graduate to grow while fulfilling organizational goals"
c58 first name,c58 last name,c58@email.com,password,PhD,-34.06528146662461,151.08975983546821,"['Bar & Beverage Staff', 'Retail & Property Development', 'Oil & Gas - Engineering & Maintenance', 'Management - Schools', 'Recruitment - Internal', 'Estimating', 'Health, Safety & Environment']",To be an astute learner and the best performer in your organization
c59 first name,c59 last name,c59@email.com,password,none,-33.746545859860426,151.24880996274882,"['Database Development & Administration', 'All Hospitality & Tourism ', 'PA, EA & Secretarial', 'Buying', 'Nursing - Educators & Facilitators']","To work in a firm with a professional work drive environment where I can utilize and apply my knowledge, skills which would enable me as a fresh graduate to grow while fulfilling organizational goals"
c60 first name,c60 last name,c60@email.com,password,none,-33.81855522412729,151.51916283913553,"['Industrial Engineering', 'Mathematics, Statistics & Information Sciences']",To pursue a challenging career and be a part of progressive organization that gives a scope to enhance my knowledge and utilizing my skills towards the growth of the organization
c61 first name,c61 last name,c61@email.com,password,postgraduate,-34.002099674832316,151.0311991148698,['Rail & Maritime Transport'],To qench my thirst of pursing a challenging career in IT field and render my services and to put all my faculties in optimum utilization and to see growth of the organization that will ensure my growth
c62 first name,c62 last name,c62@email.com,password,none,-34.024624034855115,151.0485796911006,"['Front Office & Guest Services', 'Foreperson/Supervisors']","To work as an efficient employee, giving optimum output in achieving the goal of the Organization towards success, by contributing knowledge and professional work attitude"
c63 first name,c63 last name,c63@email.com,password,postgraduate,-33.92275381652692,150.88554488004138,"['Insurance & Superannuation Law', 'All Marketing & Communications ', 'Superannuation', 'Child Welfare, Youth & Family Services ', 'Sales - Pre & Post']",To start the career and take it ahead at higher position with my continuous learning behaviour and positive attitude for the betterment of the organization
